image_name;caption
1065172.jpg;person on stage with a guitar
583757.jpg;a romantic dinner party on the river
O_4177.jpg;digital art selected for the #
17_06_8477.jpg;a woman standing in front of the ocean
794702.jpg;the new logo for the event
16_05_05_612.jpg;woman wearing a white shirt
12842.jpg;woman has short hair
1826592.jpg;a fisherman on a boat
529186.jpg;the award for best in the world
16_05_18_478.jpg;digital art selected for the #
O_6.jpg;the player is a professional basketball player.
16_05_29_622.jpg;the team on the podium
1030631.jpg;the beef and vegetable soup
484641.jpg;camera with a digital camera
1687921.jpg;the logo on the table
752065.jpg;a mother and child in a doorway
636519.jpg;politician speaks to the media.
16_05_03_223.jpg;a line of cars on a highway in the rain.
1354389.jpg;the most important thing in the world is that the whole world is.
67136.jpg;actor is the face of the man
O_3683.jpg;the most expensive players in the world
17_06_8882.jpg;a person is sitting down
95299.jpg;portrait of a young boy in yellow jacket
17_06_1302.jpg;red wine in a glass
671610.jpg;the team at the station
430766.jpg;the machine is made of metal
O_2968.jpg;my desk in my office
O_4381.jpg;man wearing a gray suit
16_05_29_635.jpg;boy holding a trophy
219225.jpg;painting of builder on the cross
34445.jpg;noble person and noble person in the wedding dress
1846818.jpg;a girl in a yellow skirt is dancing on a pier.
O_2864.jpg;the roofs of the castle are covered in snow
O_4467.jpg;people are enjoying the outdoors
135764.jpg;man wearing a suit
71903.jpg;a road in the rain
905131.jpg;girl in black with her mouth open
1083038.jpg;the entrance to the school
72889.jpg;large white and orange boat
125145.jpg;a blue and white blanket
O_3972.jpg;actor attends the premiere during festival.
16_05_28_951.jpg;man wearing a blue shirt
735597.jpg;the author's scientist's genetic or genetic form, and their identity is the author's own art that is only a part of his life.
1291447.jpg;a cat sleeping in a tutu
72166.jpg;american football player warms up before the game against sports team.
118974.jpg;the jeans are blue
17_01_19123.jpg;basketball player in the air
1946331.jpg;cartoon by person, the first black person to be released
O_1413.jpg;actor speaks during the event.
72013.jpg;the sky reflected in the window of the plane
17_06_12658.jpg;a man wearing a black jersey
295404.jpg;the plate is white
16_05_12_1175.jpg;a pair of blue jeans
180282.jpg;girl in yellow
71944.jpg;a blue sky with clouds
O_610.jpg;wallpaper with a portrait titled person
17_06_15115.jpg;the average average average average of the day
67960.jpg;comedian - i would like to pay $ 1, 000 to pay $ 1, 000.
725051.jpg;the website has been released to the website.
16_05_07_592.jpg;a woman wearing a red shirt
16_05_03_392.jpg;businessman standing in front of a blackboard with charts
237557.jpg;the cheerleaders perform during a match.
15772.jpg;person, a singer and actress, is a singer and actress.
37460.jpg;this is the only position that he has lost his career
74017.jpg;the sky is pink and orange
135299.jpg;happy birthday to actor on the cover of magazine
17_06_11487.jpg;a person pouring a bottle of wine
802619.jpg;a view of the mountains
1387195.jpg;the official poster for the film
17_06_3585.jpg;a person is standing up
O_1972.jpg;person on the catwalk
O_1835.jpg;a protester holds up a poster of politician during a protest.
17_06_2565.jpg;a collection of framed memorabilia.
1719707.jpg;pop artist is a male model, pop artist, pop artist and pop artist.
2068475.jpg;helicopter in the field
74702.jpg;texts from a friend's dog
115300.jpg;a drawing of a castle
O_4932.jpg;the team of rhythm and blues artist
684715.jpg;a man wearing a green helmet
8154.jpg;the guy in the yellow shirt is my friend.
621515.jpg;the screen is on
73053.jpg;a man walks through a church during a religious ceremony.
O_1068.jpg;actor at the premiere of thriller film
16_05_06_97.jpg;poster with text of summer music on an abstract background
332271.jpg;a storm cloud over a country road.
16_05_05_634.jpg;a group of young people
17_06_5033.jpg;two men holding a trophy
16_05_03_421.jpg;basketball player was the only player in the team that was basketball player.
O_4563.jpg;the best player in the history
1433977.jpg;man wearing a black jacket
O_4020.jpg;the game is a game of video game series
17_06_5165.jpg;the text of the day
110312.jpg;person, a retired man, is pictured with his dog.
16_05_01_127.jpg;the logo is shown in a file photo.
1021704.jpg;comic book character in a dark room
33394.jpg;the text is in the same way.
17_06_15425.jpg;a game of video game
1830780.jpg;a man wearing a striped shirt
138153.jpg;the sun sets over the mountains
16_05_15_670.jpg;the view from the balcony of the bar in the middle of the night.
17_06_12132.jpg;player in the red uniform
1826830.jpg;the mountain is green
414467.jpg;young women snorkeling in the sea
70145.jpg;person on the day of school
310679.jpg;a group of students walk through a village.
1751597.jpg;a girl in the forest
73195.jpg;a large white boat
959603.jpg;the band playing on stage
16_05_01_146.jpg;american football player runs with the ball during training camp.
72258.jpg;looking west from the corner.
62720.jpg;players huddle together before the match.
696972.jpg;tall green trees
35225.jpg;automobile model - - i want this as my car!
17_06_4831.jpg;woman with short brown hair
1858461.jpg;man wearing blue hoodie
48565.jpg;if we have no peace, it is because we have been alone to see that they are being.
245061.jpg;actor on the set of tv teen drama
16_05_12_432.jpg;celebrity at the fashion show
17_06_7130.jpg;person is the most popular person in the world
74617.jpg;beauty is not long for a long hair.
65723.jpg;portrait of a man with short hair
41881.jpg;a soldier in uniform
16_05_11_135.jpg;cartoon of a couple of people in their room
17_06_9506.jpg;woman wearing a white shirt
115122.jpg;tourist attraction is a temple located.
16_05_01_217.jpg;a collage of photos
16_05_19_818.jpg;woman in a red dress
14227.jpg;the man in the suit
109612.jpg;a man wearing a gray suit
696961.jpg;olympic athlete competes in the men's race.
1085340.jpg;the largest tree in the world
O_3945.jpg;actor as person in the movie
171351.jpg;the family with the horse
74669.jpg;the game is a game of the past
1134198.jpg;the event was held in the heart of the city.
O_1157.jpg;person is seen dancing with her dancers during a concert.
46037.jpg;the building on campus is seen.
16_05_04_580.jpg;soccer player kneeling on the ground
70909.jpg;ice hockey player in red
480599.jpg;american football player is a football player.
17_06_15157.jpg;person is a model and actress.
1348045.jpg;rugby player runs with the ball during the match.
72068.jpg;newspaper article about the history of the world
17_06_1693.jpg;"a sign that says "" club """
16_05_22_775.jpg;football player is tackled by person during the match.
689063.jpg;man in a suit and glasses
1078603.jpg;person, a former singer and former president, is pictured in a suit.
769215.jpg;a group of men
16_05_31_1059.jpg;how to write a text in a text box
818604.jpg;how can one become so true?
O_4752.jpg;politician and politician are seen in this undated image.
17_06_10525.jpg;a wall on the side of a building
16_05_23_330.jpg;a hand with a ring on it
17_06_3472.jpg;a truck is seen in front of the scene.
16_05_20_578.jpg;woman wearing a black dress
71994.jpg;a ship is sailing in the ocean.
O_2241.jpg;person and actor in the new movie
113621.jpg;the stage at the festival
593821.jpg;a sign for a car show
342143.jpg;the text is a very common sight in the study.
16_05_31_951.jpg;the river avon in the centre of the village of st. andrews, with the castle in the background.
643127.jpg;the light of the sun
71312.jpg;ice hockey player in action
2127760.jpg;the letter was found in the library.
17_06_5542.jpg;the first person to be sent to the hospital by person
50848.jpg;the floor is tiled
16_05_22_925.jpg;a group of people posing for a picture
O_2486.jpg;two women standing in the sand
317317.jpg;man and boy posing for a picture
20115.jpg;american football player and american football player take a break during practice.
O_2683.jpg;football player kisses the trophy
72526.jpg;the fleet of ships, which will be launched
1056846.jpg;a woman with long hair
73634.jpg;ice hockey player celebrates after defeating sports team in game.
364085.jpg;a dirt path on a hill
1007125.jpg;man wearing a suit
74132.jpg;the plant is tall
O_2009.jpg;politician speaks during a campaign event.
656280.jpg;the heart shaped balloon
70112.jpg;person shared this video of her boyfriend and her boyfriend
1079515.jpg;students walking on the sidewalk
14481.jpg;filming location at night from the water
36316.jpg;actor, actor, actor and person cut the cake during the celebration.
151556.jpg;person and i in the white t - shirt
17_06_16004.jpg;a screen on a tv
16_05_19_653.jpg;the team will play basketball team.
74709.jpg;basketball player in the middle of the court
71427.jpg;a pig in a cage
O_1364.jpg;a line graph shows the size of the rings.
O_92.jpg;person is the man of the world
17_01_16371.jpg;a brown cardboard box
213611.jpg;a tiger cub playing with her mother
283090.jpg;a field of poppies under a blue sky
31763.jpg;boys in the window
575961.jpg;children in a yellow bus
O_4877.jpg;comic book character and comic book character in the comic book series
901166.jpg;person in front of the white house
O_1713.jpg;person and his wife, are pictured talking in a park.
12523.jpg;the ball in the middle of the field
255047.jpg;man wearing a black suit
O_5178.jpg;fashion model in the fashion show
322142.jpg;the statue of person is seen.
17_06_11004.jpg;awards and person at awards
21231.jpg;the sign for filming location
587572.jpg;a circle of circles by person
17_06_1242.jpg;i love the sign in this one...............................
17_06_7077.jpg;a basketball player in a white uniform
116632.jpg;the secret of the ghost free vector
16_05_05_966.jpg;a man wearing a hat
25434.jpg;actor in a black shirt and jeans
680174.jpg;live live for the event
737267.jpg;stories like whisky, be like a whiskey, be all natural, in the wine.
638021.jpg;a human head is prepared for cooking.
O_3902.jpg;politician speaks to a crowd of supporters.
16_05_02_688.jpg;a wall on the side of a building
440657.jpg;poster for the women's march
17_06_7554.jpg;religious leader during an audience
O_2710.jpg;politician, pictured, was the first person to be evicted from his home
71146.jpg;person, a dog, is a popular breed.
16_05_15_195.jpg;i'm in the car with the girl in the back
O_527.jpg;person taking a picture of a snake
1990913.jpg;a city in the sky
O_279.jpg;man with a note on his chest
116326.jpg;the sign is seen on a hill.
869732.jpg;a silver tea pot
35912.jpg;the crowd gathered for the march.
16_05_29_498.jpg;a view of the building
16_05_31_1040.jpg;the new logo for the new series
72662.jpg;american football player celebrates after scoring a touchdown against sports team during the first half.
17_06_9816.jpg;person is a physical therapist who works with the body.
13149.jpg;a stone bridge over a stream
O_1912.jpg;man in hat and suit by the wall
16_05_30_1034.jpg;the singer in the music
17_06_9858.jpg;baseball player hits a home run against sports team during the first inning of a baseball game.
120222.jpg;the text says it all.
17_06_2556.jpg;a child with a black shirt
16_05_27_128.jpg;this is what i call a screenshot of the app
16_05_01_139.jpg;the first round of the season
16_05_01_555.jpg;the people are playing instruments
15512.jpg;tennis player and tennis player during their men's singles final match against tennis player on day.
754784.jpg;coach has been a professional basketball coach for the first time.
470248.jpg;actor arrives at the premiere.
2014884.jpg;the jug is white
1792882.jpg;a car is seen on fire.
1773334.jpg;the grass on the field
566271.jpg;a screenshot of the news article
17_06_1452.jpg;the poster for the basketball team.
2130227.jpg;a picture of a man with his tongue out
O_2805.jpg;the man has short hair
16_05_16_322.jpg;american football player during the game.
116777.jpg;person on the blackboard
17_06_1922.jpg;sports team vs. sports team.
17_06_12508.jpg;road closed sign in the road
70675.jpg;police and emergency personnel stand outside the home of person.
1746697.jpg;the cast of tv teen drama
694859.jpg;what do the difference between the animals?
O_987.jpg;car in the road
O_126.jpg;politician speaks during a campaign event.
90100.jpg;person is the man of the hour
14068.jpg;i'm not sure what this is, but i'm the only person in the audience.
16_05_03_630.jpg;pugs standing on the grass
16_05_26_682.jpg;a sign on the side of the road
17_06_12090.jpg;a collection of magazines
544827.jpg;the skyline is reflected in the water.
1740960.jpg;a lion on a truck
16_05_01_103.jpg;man with brown hair
116738.jpg;drawing of a board with drawings
73551.jpg;the princess in the movie
O_4757.jpg;i'm not sure if this is a cartoon.
74170.jpg;the sky is beautiful and the train is going by
519277.jpg;three men standing in a room
270641.jpg;a white blanket on the bed
1357404.jpg;person - i think they're in the ring
16_05_29_471.jpg;a sign for the state
1483703.jpg;a scene outside
1119373.jpg;the team at the finish line.
699177.jpg;a competitor competes in the final round.
17_06_1791.jpg;a chain link fence
O_292.jpg;man wearing a blue jacket
16_05_01_89.jpg;a wall on the side of a building
11400.jpg;the face of a man
629362.jpg;a wall on the side of a building
O_1754.jpg;wallpaper with a well dressed person and a business suit entitled person
72230.jpg;a city is the capital city.
1295504.jpg;the start of the ski
74427.jpg;trophies of the year for awards
120593.jpg;the sun sets over the beach
16_05_02_446.jpg;the living room of the house.
O_912.jpg;a white building with a red car
O_458.jpg;the dress is a light source of light.
746160.jpg;i'm so excited to be a dog in a world of fun.
796551.jpg;man standing at a podium
50397.jpg;a woman standing on a ramp holding a solar panel
613420.jpg;the cheerleaders performed at the game.
94399.jpg;actor is the man i want to be in my house
O_1801.jpg;the crowd at the concert
633863.jpg;two men wearing hats
67650.jpg;hard rock artist and hard rock artist
O_1582.jpg;a picture of a clock and a clock.
O_658.jpg;the wedding of person and noble person
9014.jpg;politician on the cover of magazine
16_05_04_292.jpg;a city is a major feature for all helmets at a number of vehicles.
482568.jpg;man wearing a blue shirt
16_05_26_804.jpg;the ceiling is black
319430.jpg;a drawing of a plane
O_4638.jpg;politician gives a thumbs up as he arrives.
16_05_27_174.jpg;man wearing sunglasses
O_2172.jpg;baseball player - - from the baseball team
16_05_06_960.jpg;a model presents a creation by fashion designer during fashion week.
684742.jpg;i like this text from the text
38763.jpg;fire in the city - -
17_06_5090.jpg;the food is brown
O_2312.jpg;the front page of the newspaper.
72677.jpg;blues artist - i'm a sucker for a man
693105.jpg;filming location on a map
423523.jpg;the sky is pink and blue
16_05_11_300.jpg;white lines on the road
17_06_7572.jpg;a black framed mirror
16_05_10_22.jpg;basketball player and his son celebrate after their team defeated sports team in the second round.
16_05_01_425.jpg;a young plant is planted in the ground.
O_3924.jpg;a man with grey hair
16_05_25_744.jpg;football team - - the number
381863.jpg;person is pictured in this undated photo.
17_06_12202.jpg;baby wearing a white towel
114182.jpg;the informational informational informational informational informational informational chart.
822570.jpg;newspapers from around the world
O_2013.jpg;a wall on the side of a building
17_06_905.jpg;person, a model, is seen wearing a red and white dress.
1450514.jpg;a large green and orange pumpkin
39.jpg;second story of a poster
16_05_01_102.jpg;i'm not sure what this is but i'm not sure what i'm talking about.
O_2840.jpg;a billboard for musical comedy film is shown.
16_05_02_310.jpg;the poster for the series
O_4154.jpg;basketball shooting guard delivers a speech during the press conference.
681704.jpg;actor and person at the launch party.
1839682.jpg;two men in suits
1402972.jpg;a black cat sleeping
15962.jpg;a box on a table
918692.jpg;the platform at the station
71776.jpg;students light candles during a vigil.
O_2369.jpg;a painting of a horse and a house
16_05_17_37.jpg;poster for rock album, featuring artist.
116217.jpg;the lounge area of the suite
17_06_15420.jpg;a logo for a baseball team
122517.jpg;a man wearing a black shirt
16_05_02_803.jpg;blue and white logo
17_06_15664.jpg;woman wearing a black vest
O_316.jpg;a tattoo of politician on the leg of a man
6003.jpg;person, person, and actor speak during the event.
441.jpg;the iphone is in the palm of your hand
17_06_3054.jpg;poster for the festival of beer
23051.jpg;a boy sitting at a table
O_3553.jpg;a person is standing up
24855.jpg;man wearing black shirt
131022.jpg;actor and her dogs on the streets
67344.jpg;a screenshot of the app that will be released.
68141.jpg;the fire started from a forest fire.
332778.jpg;sports facility is a sports stadium.
16_05_13_321.jpg;the crowd at the end of the day.
1743686.jpg;a new note from person, a friend of the queen.
506595.jpg;the players watch the game.
2130134.jpg;a book about religious leader
602026.jpg;digital art selected for the #
17_06_2428.jpg;a group of people posing for a picture
636009.jpg;basketball player celebrates with basketball player after scoring a basket during the second quarter against sports team.
16_05_20_735.jpg;football player celebrates scoring his side's second goal of the game with football player
797970.jpg;editorial cartoon on politician and the government
776891.jpg;a tattoo on a woman's arm
O_2742.jpg;the movie is a movie that's just for you
464366.jpg;woman wearing a black and white dress
O_3372.jpg;girl in blue
90812.jpg;a group of kids
17_06_13987.jpg;a jersey for basketball player
16_05_24_44.jpg;a bouquet of flowers
2069357.jpg;a duck on a fence
33008.jpg;water on the sidewalk is causing a slow flow of water
O_2330.jpg;man wearing a black shirt
214858.jpg;a round white plate
16_05_14_1096.jpg;the best players in the world
552482.jpg;man wearing white shirt
16_05_08_747.jpg;a pair of white shorts
417986.jpg;woman with blonde hair
70116.jpg;a screenshot of a man's face
16_05_16_847.jpg;football player is the only player to be in the team
90688.jpg;i'm not sure what i'm talking about.
73300.jpg;a group of young people stand in the crowd.
421370.jpg;aerial view of the area.
O_1302.jpg;man wearing a tie
O_219.jpg;a drawing by person, from the series
9365.jpg;a man and woman standing together
16_05_14_342.jpg;a wall on the side of a building
16_05_14_689.jpg;actor at the premiere of thriller film
13518.jpg;people sitting in bleachers
675295.jpg;the text of the day
16_05_01_749.jpg;a person is sitting down
16_05_24_809.jpg;basketball player celebrates after a basket against sports team during the first half.
517436.jpg;soldiers stand guard in front of the entrance.
16_05_05_133.jpg;a black curtain
O_1625.jpg;pop artist and celebrity are the most popular celebrities in the world
O_1842.jpg;actor... i'm a sucker for a man.
36298.jpg;a hand holding a sign
767805.jpg;the paper in the book
O_207.jpg;celebrity at the fashion show
71499.jpg;the sky is blue and white
115416.jpg;water fountain in the park
829927.jpg;basketball player poses with basketball player and basketball player.
675985.jpg;the building was lit up in the colors of the flag.
708906.jpg;the best way to find yourself is yourself in the service of others.
300986.jpg;the house is on the market for $ 1. 5 million
16_05_07_520.jpg;fans celebrate after the match.
1711334.jpg;the girl is wearing a black dress
73535.jpg;person, a - class destroyer, works on a - class destroyer.
O_3954.jpg;i'm in the black suit and white shirt
514053.jpg;students gather for a photo after a protest.
62271.jpg;the team is celebrating the victory of the championship.
1815421.jpg;the crowd at the end of the night.
16_05_29_342.jpg;person and his son during the training session.
65452.jpg;i'm not sure what this man is, but i'm not sure if he's a man.
16_05_19_856.jpg;the poster for the concert.
O_2594.jpg;actor - i love her hair like this!
16_05_02_43.jpg;person, left, is tackled by person during the first half of a college football game.
566526.jpg;woman sitting in a chair
17_01_21291.jpg;the tent is ready for the race
17_01_21950.jpg;basketball player was suspended in the air after being hit by a basketball
O_3514.jpg;man in front of the city
16_05_14_301.jpg;a person is sitting down
6274.jpg;person presenting the award to person
17_06_6068.jpg;basketball player is a former player.
233283.jpg;a shelf full of books
337204.jpg;person is a soldier who was born.
16_05_14_482.jpg;baseball player celebrates his - run home run against sports team during the fifth inning of game.
16_05_11_414.jpg;a wall on the side of a building
O_2681.jpg;politician was speaking at a festival and he said the world would be a better place.
17_06_4979.jpg;a soccer goal
22406.jpg;american football player speaks during a news conference after a football game against sports team.
16_05_24_1008.jpg;basketball player looks on during a basketball game against sports team.
1797854.jpg;the tv screen in the living room
830659.jpg;a paper with writing on it
1752194.jpg;a glass of beer
O_3433.jpg;i'm not sure what this is, but i'm not sure if i'm going to be a soldier.
122416.jpg;a drawing of person, who is a self - portrait.
16_05_21_535.jpg;a man in a yellow jersey
O_623.jpg;the girls in the mirror
17_06_4391.jpg;people are enjoying the outdoors
1475153.jpg;the best shoes for men
332783.jpg;a woman wearing a black suit
1992976.jpg;an illustration of politician and his son
O_4574.jpg;man wearing a red jacket
1132500.jpg;a large tree in a yard
728939.jpg;cricket player walks to the pitch during a training session.
71765.jpg;water over the bridge
O_3159.jpg;pop artist is a singer who has been born with a lot of words
1045196.jpg;a man uses a smartphone with a green screen.
65254.jpg;a woman in a boat
67947.jpg;the crowd watches the game.
17_06_9461.jpg;the family is in a relationship
O_2058.jpg;pop artist performs during awards.
O_10.jpg;celebrity in a silver dress
16_05_16_1009.jpg;soccer player in yellow and black uniform
16_05_26_81.jpg;a poster on the wall
1018456.jpg;students in the classroom at the conference
16_05_17_1174.jpg;woman wearing a black and white dress
O_160.jpg;the duchess and noble person were seen with a bow and arrow during a visit
1317523.jpg;a plate of food
73344.jpg;the sky is blue
482640.jpg;the building is white
365118.jpg;the dog is black
16_05_24_600.jpg;a group of people in uniform
16_05_21_228.jpg;man wearing a white shirt
O_3859.jpg;person is a model who has been in the salon.
17_06_4996.jpg;stadium seats are empty
734998.jpg;i will write in a cup of coffee
647812.jpg;thank you to person for the community!
557635.jpg;person, left, and person perform a surgery.
593000.jpg;a man wearing a black suit
739279.jpg;politician on the big screen
421972.jpg;clouds in the sky
16_05_31_419.jpg;the video shows a screenshot of the website.
584497.jpg;the water is calm
17_06_10272.jpg;a man wearing a baseball uniform
O_4545.jpg;a girl in red
1750474.jpg;basketball player is the new face of basketball player.
773878.jpg;person with his family on the way to a hospital.
O_1458.jpg;the text message of person
16_05_23_16.jpg;the jersey was designed by person.
17_06_1707.jpg;a person is sitting down
O_984.jpg;cat in a box
74182.jpg;the camera is a camera
785255.jpg;digital art selected for the #
738569.jpg;a man in a boxing ring
O_3382.jpg;politician walks with politician during a visit.
O_4701.jpg;person on the cover of magazine
525973.jpg;everything better with the football team
485155.jpg;person, who was born with a friend, was a little too.
1285562.jpg;a monkey with a white nose
973233.jpg;players celebrate with the trophy after winning sports association
670554.jpg;i'm not sure if this is a man or a man.
17_01_19846.jpg;a book about the location of the world
O_4725.jpg;the view from the top floor of the building.
718213.jpg;person, person, and person at the event.
760482.jpg;a glass on the table
42084.jpg;the text of the death of a man
70398.jpg;baseball player celebrates after throwing out the first pitch in the fourth inning of a baseball game against sports team
525321.jpg;man wearing a suit
122290.jpg;the text of the month
71715.jpg;the new bridge over the highway
74136.jpg;the water is blue and clear
50430.jpg;a woman is seen during a protest against politician.
16_05_15_1082.jpg;the guy in the white shirt
64207.jpg;the car of the future
73995.jpg;rhythm and blues artist in a video
1062575.jpg;the first time i was to start a game of cards.
O_4765.jpg;politician on a scooter
17_06_2731.jpg;strobist info : sb600 bare sb600 with white gel over blue background
1055064.jpg;person, person, person and basketball player.
71887.jpg;a wall on the side of a building
1825763.jpg;mysterious dark forest with moss on the ground
16_05_11_398.jpg;pop artist at the event
1317539.jpg;a wild bird on the beach in the galapagos islands.
O_3594.jpg;poster for the album by person
521875.jpg;american football player says it all.
16_05_23_969.jpg;people on a boat
565853.jpg;the original wooden bat was signed by the artist.
16_05_21_22.jpg;man wearing a blue and white uniform
O_869.jpg;a man standing in the back of a truck
O_3846.jpg;this is a male in a white turban
O_1240.jpg;a large screen
1855393.jpg;a collection of photographs depicting the history of the past
72988.jpg;aircraft model is a fighter aircraft designed by person.
374394.jpg;person plays guitar during a performance.
700529.jpg;a scene outside
903072.jpg;the lights are on
632187.jpg;man wearing white shirt
