image_name;caption
17_06_332.jpg;a large building
16_05_09_505.jpg;poster of a woman with a black top and a red eye
521612.jpg;the grass is starting to grow.
O_2989.jpg;pop artist and rhythm and blues artist
17_06_2655.jpg;man wearing a blue blazer
17_06_8903.jpg;two women hugging
486085.jpg;the plane is casting a shadow
72864.jpg;newspaper article about the history of the game
O_5053.jpg;a shirt with a quote from person
116244.jpg;the chandelier is gold
16_05_29_712.jpg;a large green tree
73556.jpg;a table with food and drinks
17_06_12042.jpg;person, the person who will be the first person to be evicted.
345386.jpg;a man wearing a white shirt
O_2460.jpg;person during an interview with comedian - -
17_06_2736.jpg;american football player was the first player to win award category.
O_1204.jpg;the stage of the show
71057.jpg;ice hockey player celebrates his goal with ice hockey player during the first period of a hockey game.
591264.jpg;the shirt is pink
65272.jpg;american football player is a former football player.
72543.jpg;politician delivers a speech to a crowd of supporters.
13398.jpg;the mountains in the background are reflected in the water.
17_06_14295.jpg;the shirt is gray
488056.jpg;a drawing of the head of politician
1978101.jpg;a tree with red leaves
416124.jpg;a customer holds a can of organic food.
97085.jpg;the girl who's got to swim in the water
16_05_03_387.jpg;a protest against the government
16_05_19_634.jpg;logo for the new company
1097438.jpg;the first day of the season, the team is in the box with the blue and red lettering.
685886.jpg;a city is lit up at night.
O_603.jpg;man with dreadlocks
1336838.jpg;the website on the website
93239.jpg;a billboard advertising the blues
279938.jpg;woman speaking at a podium
65257.jpg;the tree is blue
17_06_6377.jpg;a man in a white uniform
702448.jpg;the water level is a little higher than the dam.
820101.jpg;a large group of people
16_05_18_501.jpg;a couple posing for a picture
17_06_9054.jpg;a package of blue and white tissue
12822.jpg;people walking on the tracks
17_06_13453.jpg;soccer goalkeeper ready to kick the ball into the net vector art illustration
O_3230.jpg;i'm not sure what this is, but i'm not sure what i'm talking about.
1814985.jpg;a crowd of people
743553.jpg;a bottle of green beer
70437.jpg;my hope will leave the world
50168.jpg;person is the new face of the singer
1039719.jpg;the blue house in the middle of the street
255356.jpg;the train arrives at the station
16_05_26_646.jpg;person, left, and person look on as person defends during a game.
O_3876.jpg;a man holding a tennis racket
111445.jpg;the new system is a must for any computer.
475449.jpg;suspension bridge from the air
1011101.jpg;person speaks to the media.
248408.jpg;a train on the tracks
745394.jpg;football player celebrates with soccer player after scoring the opening goal during the match.
1355122.jpg;person, a dog who was adopted by person.
73826.jpg;a storm cloud over a beach
O_2537.jpg;woman wearing a black jacket
113342.jpg;man wearing a black shirt
129457.jpg;purple and orange plaid shirt
117929.jpg;a family of four holding signs
17_06_6010.jpg;person was seen walking through the park with a police officer
478894.jpg;a painting of a woman hugging a man
1301421.jpg;person, person and actor pose with their car.
71207.jpg;a group of soldiers
1994872.jpg;a bowl of food with a variety of ingredients
16_05_10_349.jpg;a wooden table
1417638.jpg;how do we turn this country into a country
819987.jpg;a group of people standing around a table
71980.jpg;fans cheer during the game against sports team.
16_05_03_201.jpg;footballer, head coach, looks on during the match.
94038.jpg;people pictured at the event.
16_05_15_408.jpg;the girl is wearing a blue shirt
444201.jpg;pop artist in a plaid shirt
O_3458.jpg;if you are not a fan of the text, this is what you want to buy.
71472.jpg;a blue garbage can
421933.jpg;kids having fun in the water
17_06_15295.jpg;basketball player in the game
871107.jpg;the white house was seen in this undated image.
902682.jpg;person in a dress
605168.jpg;the class of the medical staff
62326.jpg;a general view of the crowd during a game.
282783.jpg;a cloudy blue sky
445590.jpg;the fashion collection by fashion designer
16_05_29_893.jpg;a helmet for sports team.
65633.jpg;a picture of a lighthouse
16_05_08_986.jpg;the boys of the show
16_05_11_692.jpg;a long concrete sidewalk
65230.jpg;person was greeted by the crowd
17_06_3673.jpg;footballer celebrates after scoring his team's first goal during the final.
74236.jpg;american football player holding a football
O_524.jpg;the best movie ever!
O_5032.jpg;politician, now that politician is a man who has been killed on all of her women's lives with all of their own women.
16_05_16_1071.jpg;the team is standing on the grass
16_05_27_697.jpg;basketball player playing basketball on the court
O_357.jpg;the most beautiful actors of the 2000s
71196.jpg;a hockey player on the ice
346279.jpg;basketball shooting guard during a game against sports team.
13913.jpg;the painting is a work of art.
1034154.jpg;a small bowl of green tea
7124.jpg;cartoon of the day : the boss
675823.jpg;the most interesting cars in the world
1361774.jpg;people gather in a village.
1792131.jpg;drawing of a circle on a wall
16_05_05_742.jpg;a baseball player wearing a white uniform
16_05_07_376.jpg;a man running on a race track
93388.jpg;a man wearing a cowboy hat
62356.jpg;a man wearing a blue hat
1352094.jpg;woman wearing a pink scarf
16_05_04_526.jpg;just a few of the girls who love to have a few more of their own faces
O_1853.jpg;politician shakes hands with politician before a meeting.
16_05_04_111.jpg;the logo is seen on a red background.
68044.jpg;a group of men stand on the steps of the building.
17_06_10869.jpg;baseball player watches his team during the first inning of a baseball game against sports team.
14055.jpg;a girl with brown hair
942392.jpg;man wearing a name tag
1040568.jpg;a group of women hold signs during a protest against the government.
771669.jpg;a poster showing the countries.
1061453.jpg;a man wearing a blue shirt
93541.jpg;filming location in the clouds
O_2875.jpg;actor in a scene from the film
16_05_06_451.jpg;the woman is wearing a dress
944383.jpg;a person is standing up
17_06_12277.jpg;pitcher is about to throw the ball
16_05_01_438.jpg;a man in a white shirt
146390.jpg;the poster for the game
159985.jpg;aerial view of the beach
33550.jpg;the front page of the newspaper.
O_4150.jpg;politician, the first president, is now a political candidate.
110561.jpg;politician waves to the crowd as he arrives for the presidential debate.
423227.jpg;the team with the family
46036.jpg;the sign for the new office building in downtown seattle.
16_05_07_639.jpg;wallpaper with a portrait titled actor
610581.jpg;police officers walk through the streets.
16_05_22_389.jpg;man wearing a suit
722505.jpg;country artist performs on stage during awards.
1009352.jpg;i'm not a fan of the glasses
O_5010.jpg;person and blues artist on stage
73264.jpg;a fighter aircraft flies over the airfield.
803604.jpg;the chandeliers are hanging
62292.jpg;a city is the capital city.
O_3905.jpg;the model is a sculpture by person.
16_05_04_283.jpg;a group of boys
16_05_21_532.jpg;a baseball player
33479.jpg;protesters march down a city during a protest against politician.
124558.jpg;the number of people in the line
O_2620.jpg;digital art selected for the #
659252.jpg;person in a red dress
1098520.jpg;man holding guitar
1704203.jpg;politician poses with a sign.
17_06_8801.jpg;a group of people posing for a picture
31920.jpg;a man taking a picture
739055.jpg;footballer celebrates with his team - mates after scoring his team's second goal during the match.
568010.jpg;large building with columns
319338.jpg;american football player reacts after a play against sports team during the first half of a football game.
130830.jpg;pop artist in a cap
16_05_03_1044.jpg;fans celebrate after the match.
71394.jpg;aerial view of the junction.
1012126.jpg;bottle of champagne in a bowl
16_05_17_821.jpg;a group of men posing for a picture
16_05_01_724.jpg;a portrait of blues artist
687905.jpg;football player is mobbed by his team - mates after scoring the opening goal
O_4122.jpg;a man with brown hair
16_05_17_494.jpg;this is the final look of the team.
122565.jpg;poster for the movie poster
950886.jpg;novelist sitting at a table with a typewriter
1352028.jpg;a person is standing up
28793.jpg;i'm in a dog's mouth.
16_05_28_1012.jpg;man wearing a white shirt
659842.jpg;a dirt road
16_05_17_794.jpg;baseball players, the most important person in the world
71939.jpg;digital art selected for the #
65331.jpg;the car was damaged after the crash.
592276.jpg;breaking the bank of america
355478.jpg;professional boxer is the most professional boxer in the world
16_05_23_916.jpg;poster for festival, festival.
130765.jpg;the team of tv genre
O_4715.jpg;politician speaks during a campaign event.
190167.jpg;never care someone like a whole lot of anything you care about.
1373582.jpg;the door is yellow
33009.jpg;person, a journalist, speaks to journalists before the start of the event.
16_05_17_629.jpg;woman wearing blue shirt
663717.jpg;an elderly man walks through the airport.
1074779.jpg;the moon is seen in the early morning hours.
124341.jpg;shelf of items
444189.jpg;pop artist is the face of a man
123957.jpg;the room is clean
17_06_4471.jpg;the cart is wooden
16_05_16_323.jpg;a collage of photos of fans
64414.jpg;man wearing a black suit
17_06_11043.jpg;two women hugging
560264.jpg;a map showing the route of the proposed highway.
O_1329.jpg;the text of the world
31914.jpg;comic book character and comic book character.
1042987.jpg;man wearing a black jacket
34064.jpg;students sitting on the deck
445423.jpg;artist and person in a hat
71845.jpg;man wearing black pants
37145.jpg;we're all like a full scale
17_06_2955.jpg;a group of people playing baseball on a field.
17_06_8352.jpg;a look at the logo.
O_360.jpg;the power of change is a change.
582807.jpg;the car was parked in the street
736346.jpg;a screenshot of the game
33083.jpg;a man in a car holding a cell phone
93088.jpg;a person is sitting down
13787.jpg;the first day of the election.
468676.jpg;a group of women
O_4360.jpg;man wearing blue jeans
662863.jpg;a table of information about the event
O_651.jpg;basketball player reacts after a basket against sports team during the second half.
17_06_11788.jpg;basketball player and basketball player celebrate with the trophy after winning sports league championship.
16_05_18_941.jpg;person and her daughter, at the event.
671565.jpg;the text of the event
20109.jpg;american football player looks on during the first half of a football game against sports team
699969.jpg;a picture of a skier
16_05_01_498.jpg;person warms up before the game against american football team.
O_2319.jpg;person, a man who has been dating back to the 80s
O_2532.jpg;two women standing together
O_556.jpg;it's never never been to try and try to try to try to try to the dark side of human body.
17_01_18239.jpg;the girl in white is the guy
422967.jpg;a circle of icons in the form of a circle
2073079.jpg;man and woman standing next to each other
1307285.jpg;a display case with pastries
32184.jpg;lady in red dress
619043.jpg;this t - shirt is available for purchase.
17_06_10106.jpg;a white tent
O_1905.jpg;i'm so excited to see this guy.
16_05_12_627.jpg;the app app applauds the fans as they left the game
17_06_14694.jpg;two men wearing baseball caps
O_3219.jpg;celebrity and actor share a kiss on stage during the ceremony.
O_2546.jpg;basketball player and basketball player speak during a press conference.
16_05_26_546.jpg;a wall on the side of a building
118452.jpg;person, left, talks to a police officer in his car.
O_2082.jpg;person, person, and pop artist perform at the event.
O_4772.jpg;politician waves to the crowd as he arrives for his presidential campaign event.
16_05_24_896.jpg;a large banner
74964.jpg;person is a girl who has been living in a house.
16_05_27_432.jpg;the girls in green
O_2130.jpg;music video performer and musical artist are all smiles as they pose for photos.
571588.jpg;the team celebrates after winning the final.
1993288.jpg;the art of martial art
1946351.jpg;actor and person were spotted having a drink while on vacation.
727447.jpg;the building is tall
73985.jpg;a brick paved road
O_4892.jpg;person on a horse by person
16_05_01_606.jpg;sports team vs sports team.
17_06_4084.jpg;man playing a bass guitar
1753440.jpg;a large crowd of people
928023.jpg;person, a painting by person
427591.jpg;the logo is a logo for the company.
16_05_26_856.jpg;a plate of food
820649.jpg;person speaking at the event
O_594.jpg;a man sitting on the floor
16_05_19_331.jpg;a flight of space and space
16_05_05_277.jpg;the word on the wall
1301353.jpg;the game is played on the screenshot
O_444.jpg;basketball player, left, drives to the basket against basketball player during the first half of a basketball game.
692041.jpg;the cable is black
64536.jpg;a bird standing on the beach
1760156.jpg;the football stadium at night
16_05_10_719.jpg;the choir performs at the concert.
O_1409.jpg;woman wearing a red white and blue jacket
170519.jpg;basketball player was the only player to score a point in the game.
211474.jpg;curtains on the window
93942.jpg;woman wearing a white shirt
O_3111.jpg;a man wearing a suit
17_06_11033.jpg;men standing on the grass
70454.jpg;the view from the air
675747.jpg;a man with a beard and a beard.
16_05_01_138.jpg;the grass is green.
17_06_11936.jpg;man wearing a black shirt
16_05_20_664.jpg;a couple smiling
71772.jpg;late gothic revival structure and tourist attraction
8575.jpg;light at the end of day
30152.jpg;person, who is the lead singer for the song, said she was the first person to be a fan of the show
820064.jpg;politician shakes hands with the crowd
151882.jpg;a large plume of smoke rises from the fire.
O_4858.jpg;this is the first time i saw person.
1109405.jpg;the view from the top of the building
62391.jpg;person presents the award to person
295400.jpg;the building is made of brick
701791.jpg;win a video game for your next generation
259016.jpg;a text of the government is not a political statement.
O_2359.jpg;the cast of tv drama
594391.jpg;the first poster for politician.
687667.jpg;actor poses on the red carpet
71236.jpg;a group of boys playing football in a field
16_05_28_195.jpg;football player and football player celebrate with the trophy after the final whistle
1133033.jpg;the best people in the world have big, big, big, big, big, big, big, big, big, big, big, big, big, big, big, big
863787.jpg;the presentation of the event
136571.jpg;a sign on the wall
127314.jpg;a woman holds a sign as she walks past a store.
809186.jpg;person, who was elected as the ambassador, said she was a member of the community.
1367967.jpg;a clear blue sky
1311544.jpg;cat laying on the couch
628292.jpg;the road to the cabin
16_05_05_596.jpg;three girls playing soccer
303930.jpg;the pool is clear
16_05_06_92.jpg;black piano with white keys
16_05_21_560.jpg;a poster for a concert.
32086.jpg;person is a very popular person who has been born in the world.
228710.jpg;the sign outside the office
452547.jpg;smoke from the stage
1760716.jpg;aerial view of the landscape
815997.jpg;a city is a city.
17_06_5430.jpg;a man in a yellow shirt
1487432.jpg;man in a bathrobe
658813.jpg;a large screen on the wall
525824.jpg;the houses in the city
113438.jpg;the text of the day
73180.jpg;the sky is blue and white
576.jpg;pop artist performs during the concert.
67423.jpg;the first 3d model of the game
O_679.jpg;happy : the singer shared a photo of herself with her friends
16_05_20_802.jpg;person posted this photo of herself posing in her bikini
1413482.jpg;players stand for a team photo before a college basketball game against american football team.
117375.jpg;man wearing white shorts
71408.jpg;person, a sailor, poses for a photo
516317.jpg;a woman wearing a black lanyard
494092.jpg;the girls of the princess
16_05_02_349.jpg;person and actor on the set of tv sitcom
16_05_09_383.jpg;a letter on a picture
65627.jpg;the first time i've seen a number of people in the world.
715781.jpg;pop artist performs on stage during the dress rehearsal
46143.jpg;a few of the best fast food restaurants
1063994.jpg;hamburger with vegetables on a white background
664451.jpg;a stone sculpture of a woman sitting on a man's lap
73125.jpg;the number of flights were cancelled
O_1332.jpg;a photo of politicians with a black background.
O_1494.jpg;group of men posing for picture
117357.jpg;birds in the sky
1025886.jpg;river in the valley of person
16_05_04_248.jpg;person is the best player in the world.
1084260.jpg;a group of people
109554.jpg;the front of the building
139778.jpg;the crowd at the nightclub
17_01_13449.jpg;a wall on the side of a building
O_3498.jpg;the boys in the bowling alley
O_4392.jpg;woman sitting on a chair
583416.jpg;person with some of his friends
O_1795.jpg;members of the public attend awards
1289692.jpg;man is smiling
530953.jpg;politician has a haircut that was cut by politician.
16_05_12_1140.jpg;woman has brown hair
1126676.jpg;man wearing a black jacket
1464226.jpg;i like the girl in the picture... but i'm not sure what they are... but i'm not sure.
12852.jpg;a brown wooden table
16_05_21_787.jpg;a baseball field
16_05_01_362.jpg;politician, a former president, is pictured during a speech.
67250.jpg;a group of people
412038.jpg;this is what my dog looks like after he was sitting on the couch in the living room.
O_159.jpg;person, who was the first person to ride a bike, was the first person to ride.
707214.jpg;i love the idea of a dress with a bow.
418335.jpg;man sitting in front of microphone
1368452.jpg;a screenshot of the app
62781.jpg;actor, a singer and actress, is a singer and actress.
O_4696.jpg;comedian during an interview - -
16_05_30_656.jpg;a glove made of recycled plastic
17_06_10963.jpg;dog laying in the grass
16_05_19_311.jpg;two kids with sunglasses
O_82.jpg;politician speaks during a campaign event.
114554.jpg;billboards on the side of the building
300911.jpg;the view from the living room
O_432.jpg;i'm in charge of all my friends.
116414.jpg;the - story tower is located.
747089.jpg;humpback whale off the coast
17_06_11315.jpg;the elephant was found in the river.
17_06_2846.jpg;basketball player in the middle of a game
17_06_6522.jpg;the girl in the middle
17_06_7880.jpg;a young girl with a pink nose
74493.jpg;a poster of the new website.
1374916.jpg;"the book & amp ; quot ; the book & amp ; quot ; book store in the center of the city."
1740559.jpg;actor arrives at the premiere.
1042724.jpg;me and my friend in the mirror
418340.jpg;a person is standing up
71144.jpg;a group of firemen
17_06_2682.jpg;man with a beard
953369.jpg;people working in the garden
O_1453.jpg;pop artist, a portrait of person
2083841.jpg;the event was held at the venue.
74807.jpg;the menu at the baseball game
117341.jpg;a line of students from schools
70480.jpg;actor in a black dress
67572.jpg;artist on stage at festival
O_3467.jpg;a record of the most popular music
196723.jpg;a wall on the side of a building
O_891.jpg;woman with blonde hair
93736.jpg;the first letter to person
1041792.jpg;the first floor of the new building in the new orleans.
16_05_23_87.jpg;the dog is laying down
O_3895.jpg;a girl at a desk
17_06_7257.jpg;the logo for sports team
28649.jpg;me in the hat box
1764161.jpg;the cast of tv teen drama
O_3953.jpg;blues artist and rock artist at a party.
1763577.jpg;sunset view from the deck
O_3224.jpg;the game is a game of the past
71184.jpg;a man eating food
521026.jpg;the water is so clear that you can see the bottom of the pool
1485250.jpg;man wearing a brown suit
790174.jpg;the sign is white
16_05_28_766.jpg;group of people posing for a picture
72915.jpg;person in a tree with a bicycle
149206.jpg;footballer celebrates after scoring his team's second goal during the match.
16_05_17_858.jpg;football player celebrates after scoring his side's second goal of the game
1120491.jpg;the front page of the newspaper
O_2918.jpg;pop artist performs on stage during the tour.
1045029.jpg;a man in a suit and tie
543922.jpg;a page from the newspaper.
747586.jpg;an investment in knowledge is always the best choice.
1398525.jpg;the rapper was also seen performing on stage
1113775.jpg;the dog nanny, dog sitter
1767715.jpg;the steak is cooked
603479.jpg;a woman's short cut black hair
73440.jpg;man wearing blue hat
181120.jpg;person on the cover of magazine
728750.jpg;a vintage document based on the letter
O_2101.jpg;man in black and white plaid shirt
694432.jpg;a group of young women in the mist
751097.jpg;person, a member of the public, speaks at the event.
O_4875.jpg;actor is a man of the most beautiful people
16_05_06_572.jpg;a person is sitting down
800186.jpg;graduates wait for their turn to receive their diplomas during the graduation ceremony.
525352.jpg;person speaks at a meeting.
71688.jpg;a palm tree in front of a building
63983.jpg;this world is but a painting to our imagination.
918700.jpg;the poster of the family
17_01_6571.jpg;the text is red
1077743.jpg;a new banknote features a face made of dollar bill.
16_05_18_990.jpg;sign all the way around the world
17_06_9168.jpg;a screenshot of a video of a video of a woman performing on stage.
149223.jpg;man holding a man
16_05_11_824.jpg;american football player warms up before a game.
16_05_07_750.jpg;fans celebrate on the tv screen
115111.jpg;newspaper display
17_06_15495.jpg;donkey with a big smile
68112.jpg;a poster of a face with bullet holes
114728.jpg;colorful glass art on the wall
17_06_6107.jpg;people are enjoying the outdoors
450022.jpg;this cat is ready for the party!
O_973.jpg;actor with a horse on the set of the film.
72866.jpg;american football player celebrates after a touchdown during the first quarter against sports team.
1479038.jpg;this is a screenshot of the app
72763.jpg;a military ship is being launched
1942620.jpg;person shared this photo of her dad and his dad on facebook
21554.jpg;the sandwich is a must - have.
943572.jpg;statue of woman in yoga position
O_4044.jpg;politician is the only person to be seen in this photo.
651037.jpg;the team celebrates with the flag
73686.jpg;a city is a town.
608735.jpg;person, left, and person pose for a photo
16_05_15_280.jpg;a green shirt on a table
116474.jpg;the black chair
17_06_14040.jpg;people are enjoying the outdoors
O_3240.jpg;a man wearing glasses
O_2487.jpg;pop artist with a mirror
16_05_24_136.jpg;the first logo for the film
1077275.jpg;the future of the future
1685058.jpg;person, president, is the first person to be evicted.
1348499.jpg;football player celebrates scoring his side's second goal of the game
15649.jpg;black t - shirt with a design
1434250.jpg;i'm not sure what this is, but i'm not sure if it's a wall or a door.
116385.jpg;person giving a speech at the conference.
109765.jpg;the protest took place in the city
73249.jpg;the demolition of the building.
41202.jpg;a woman with braids in her hair
17_06_651.jpg;woman with long black hair
O_251.jpg;politician has been named the most popular person in the world.
70700.jpg;a wall on the side of a building
65040.jpg;the largest number of jobs moving from the region.
1462751.jpg;my dog in the grass
735893.jpg;actor, a former writer, is a former writer and director.
O_1765.jpg;politician waves to the crowd as he arrives for his presidential campaign event.
35780.jpg;the video shows the video showing the video that was taken by person
1739563.jpg;red sticker on the back of a red sticker
64918.jpg;black chairs in the kitchen
O_2642.jpg;i want to send this!
1412529.jpg;a scene during the day time
1772642.jpg;person is the only person who can ever see.
46273.jpg;the view from the plane
16_05_26_167.jpg;a set of rocks
16_05_01_260.jpg;basketball player, basketball player and basketball player speak on stage during the awards.
90044.jpg;football player and his son, who played for football team.
16_05_01_82.jpg;the guy in the blue shirt is my friend.
119156.jpg;the waterfall is flowing
O_2468.jpg;actor during an interview with comedian - -
729340.jpg;a man and his dog stand on a lake.
528381.jpg;person talks to the media.
O_1951.jpg;politician addresses a crowd of supporters during a rally.
73166.jpg;fans wait for the start of the game.
24586.jpg;a man wearing a suit and tie
353564.jpg;a large screen on the wall
1291956.jpg;the fire in the building
17_06_7713.jpg;woman with white hair
1458541.jpg;pop artist and soft rock artist perform on stage
16_05_14_457.jpg;a man wearing a black jacket
17_06_6614.jpg;poster for the presentation of food
90115.jpg;football player and soccer player in the final
63264.jpg;the cheerleaders perform during a match.
67864.jpg;politician delivers a speech during a meeting.
71477.jpg;the building was demolished to make way for the new stadium.
1120223.jpg;the beauty of a woman
16_05_24_478.jpg;a poster for a concert
O_4411.jpg;comedian and actor during an interview with comedian
237510.jpg;this text from person is not just as good as it is.
520901.jpg;lava flowing into the ocean
116466.jpg;the pool is blue
O_2851.jpg;music composer performing on stage
1284965.jpg;a guide to the best religious text
33643.jpg;people pray in a temple
1876041.jpg;warning signs of the dangers
O_581.jpg;funny pic of a girl laughing
112084.jpg;the cloud can see if it could see it.
16_05_22_293.jpg;digital art selected for the #
16_05_08_164.jpg;a person is standing up
16_05_16_380.jpg;the player of the game
1155527.jpg;the procession of religious leader
17_06_6802.jpg;a scene during the day time
414719.jpg;a city is the tallest building in the world.
62464.jpg;politician, left, and politician, shake hands after a meeting.
116420.jpg;a wall on the side of a building
560325.jpg;the couple will be celebrating the new year
485341.jpg;the grave of person, who died.
