image_name;caption
7234.jpg;politician, left, and person during a meeting.
600094.jpg;a long white sign
16_05_02_940.jpg;the trophy is a symbol of the team.
109759.jpg;a man and a woman sitting on a couch
72376.jpg;hand of a pilot waving to a helicopter
O_1708.jpg;a woman wearing a blue dress
16_05_09_642.jpg;this text from person is not just about the wrong number.
17_06_8212.jpg;football player celebrates scoring his sides first goal during the match.
16_05_20_493.jpg;a baseball stadium
O_2447.jpg;wallpaper with a portrait titled person
966333.jpg;i'm not sure if i could get a text from the same line, but i'm not sure what it's like.
1992653.jpg;a woman sitting at a table
O_965.jpg;blue jacket on mannequin
71856.jpg;military conflict, painting by painting artist
527443.jpg;a mural by person, a local artist.
16_05_25_808.jpg;festival - - festival of the year
16_05_12_404.jpg;a woman wearing a red hat
1486617.jpg;digital art selected for the #
16_05_04_36.jpg;a person is standing up
28588.jpg;tv in the classroom
16_05_24_978.jpg;a gray sweater
33390.jpg;a scene inside
O_2046.jpg;i'm going to buy this!
63235.jpg;footballer celebrates scoring the opening goal during the match.
588.jpg;the number of data is better than the average person.
1096585.jpg;the statue of person and fictional character
1768426.jpg;actor on the set of tv sitcom
1134211.jpg;the water is white
862.jpg;person on top of the world
O_2901.jpg;soccer player during the match.
17_06_15741.jpg;woman holding a white shirt
114507.jpg;actors at the premiere of comedy film
67787.jpg;person, a former man who was born.
16_05_21_840.jpg;a plate made for dining
65726.jpg;olympic athlete celebrates with her team mates after scoring a goal during the match.
O_1030.jpg;a sand sculpture on the beach
16_05_26_49.jpg;players standing in a dugout
73795.jpg;dog running on football field
16_05_05_499.jpg;girl has long hair
O_1035.jpg;the game is a game of basketball
O_256.jpg;person in a floral dress
O_2662.jpg;actor in a gown by film costumer designer
93929.jpg;the lion and the lion
17_06_7418.jpg;basketball player and basketball player during the second half of a basketball game.
812142.jpg;the beach in front of our hotel
464585.jpg;a boat on the water
16_05_05_175.jpg;tennis ball in the air
O_163.jpg;hip hop artist performs on stage during festival.
123272.jpg;the brick wall is red
411031.jpg;the letter from film director
422197.jpg;a woman was struck by a car.
O_3223.jpg;man holds a white handle
12742.jpg;film character and the cat.
139111.jpg;the team celebrates after winning the gold medal
45855.jpg;actor and wrestler on the set of tv teen drama
116791.jpg;computer hardware business has unveiled a new smartphone that will be available in stores
1383594.jpg;flags are displayed on the floor.
594009.jpg;a number of doctors are working on the virus.
73852.jpg;a tree with green leaves
38329.jpg;a person wearing a yellow hoodie
O_2439.jpg;politician speaking into a microphone
16_05_27_71.jpg;the shoe box in the store.
1763218.jpg;actor is all smiles as he arrives at the premiere of thriller film.
1040155.jpg;cartoon of a cartoon character with a funny face
O_4975.jpg;a woman with long hair
918740.jpg;a horse pulling a cart with a horse on it.
1464952.jpg;person, who was a child, was born.
1044038.jpg;turn the record on the record
1735160.jpg;children ride a carousel at a park
16_05_18_160.jpg;this shirt was made for a friend.
16_05_10_756.jpg;collage of people
863291.jpg;a painting of a tribal woman
16_05_12_980.jpg;the app is a screenshot of the game
O_4143.jpg;pop artist and pop artist at awards
16_05_01_474.jpg;man wearing black shirt
1395835.jpg;baseball players in the locker room
421656.jpg;a badger sleeping on a red sand dune.
37485.jpg;a man in glasses and a black jacket
16_05_06_1048.jpg;a woman holding a book
790991.jpg;a crowd of people in the streets
1351580.jpg;i am not a product of my own.
16_05_02_767.jpg;a scene during the day time
17_06_63.jpg;logo for sports team, as seen in a blue and red circle.
O_198.jpg;the best books in the world
49057.jpg;a portrait of a man
16_05_31_288.jpg;the team of the year
O_4011.jpg;person with a beard and a beard
607282.jpg;a competitor holds a flag during the final.
70600.jpg;a man sitting in a chair
O_164.jpg;a screenshot of the screenshot
536482.jpg;# dribbles the ball against sports team.
17_06_15269.jpg;man wearing a suit
1009286.jpg;man holding a white cloth
16_05_08_527.jpg;poster for the concert hall
773547.jpg;the girl in the white shirt is my friend.
O_4021.jpg;we can do what we want to ever want to ever want to ever want for the little people
16_05_25_1041.jpg;politician, president, smiles as he speaks during a news conference.
O_4273.jpg;a man giving a speech
O_1674.jpg;hip hop artist and hip hop artist perform at festival.
O_1667.jpg;i love this man with a man
O_436.jpg;man wearing a white coat
62358.jpg;rhythm and blues artist performs at awards
770662.jpg;the number of people in the line
16_05_02_561.jpg;the man was seen running into the crowd
94356.jpg;the man is standing
116522.jpg;the pool and patio at sunset
92404.jpg;newspaper article about the world
136906.jpg;the rear of a car
390975.jpg;sports team, the most famous player in the world
73060.jpg;the people are standing
70012.jpg;the girls in the house
575168.jpg;contest entry # for design a logo for a company
16_05_20_399.jpg;large cylinder shaped object
16_05_18_776.jpg;a person is standing up
65804.jpg;the sky is blue and white
754901.jpg;a car driving through the desert
16_05_31_352.jpg;a soccer net
16_05_12_531.jpg;a building with a lot of windows
458818.jpg;celebrity walks the runway during show.
93183.jpg;person, a fashion model, by photographer
414251.jpg;a view of the city
16_05_04_451.jpg;the logos of the teams
154915.jpg;pop artist performs on the stage during awards
O_4881.jpg;actor and tv character in the new movie
O_2336.jpg;president obama giving a speech
17_06_13432.jpg;a woman in a field of sunflowers
14475.jpg;a woman is on a stage
17_06_13819.jpg;people sitting at a podium
16_05_27_210.jpg;person, left, and person, shake hands during the ceremony.
5898.jpg;get to the world premiere
16_05_18_592.jpg;cardboard box on the ground
O_4814.jpg;actor as person in the movie
15839.jpg;the boy in red
74083.jpg;a crane on a building
O_4547.jpg;person, actor, martial artist and actor.
45722.jpg;basketball player, who is the best player in the world, is the best player in the world.
36611.jpg;a family portrait of person.
577913.jpg;i'm not sure what kind of beards are, but i'm not sure what they are.
809366.jpg;person, center, and person at the podium
614257.jpg;a person wearing a black shirt
92317.jpg;a man wearing a suit
73231.jpg;man in white shirt
17_06_8641.jpg;this is what happens when you have a text message.
17_06_4671.jpg;a basketball player
418195.jpg;man with brown hair
17_06_655.jpg;a pair of shoes on a sidewalk
570486.jpg;dark blue sky
541630.jpg;a new look for your hair
134113.jpg;sports team are a team of the top players
127300.jpg;man holding a plate
71955.jpg;fans cheer on their team during the first period.
123416.jpg;pop artist is a singer and songwriter.
29833.jpg;a boat on the water
641284.jpg;person with a friend at the club
16_05_07_524.jpg;festival - - festival of the arts
73351.jpg;men dance in the streets during the parade.
16_05_02_208.jpg;woman holding a white drum
441032.jpg;the chairs are gray
1063599.jpg;this is a great idea for a speaker.
1469624.jpg;silhouettes of people dancing on a striped background
16_05_05_543.jpg;a large group of people
293392.jpg;a large group of people
587891.jpg;person receives award from person
1475162.jpg;the girl in the pink shirt
1839280.jpg;a man and a woman
629328.jpg;person and his wife, are pictured holding a sign that says he's holding.
17_06_14115.jpg;man wearing a red shirt
O_1252.jpg;actors at the premiere of the film
474314.jpg;a sample of the new design
334651.jpg;a view of the road from the train station in mumbai.
466853.jpg;person, who was the first person to be evicted from the house.
16_05_26_364.jpg;ice hockey player # of the skates against sports team during the first period of a hockey game.
1771624.jpg;a little boy sitting on a stack of hay
O_1736.jpg;actor, the most famous actor in the world
1289546.jpg;i'm not sure what i'm doing but i'm not sure what i'm going to be a lizard.
470732.jpg;person and his wife, walk down the street in front of the building.
127657.jpg;fire truck is red
799437.jpg;a wall on the side of a building
O_4667.jpg;person was seen through the window of his house
70781.jpg;a picture of a hockey player
110026.jpg;a poster for all designs.
72308.jpg;a man with a camera
16_05_16_1059.jpg;blue sky above the crowd
O_3825.jpg;my boyfriend's boyfriend is my boyfriend and my boyfriend is my boyfriend.
71269.jpg;man wearing a blue shirt
17_06_9233.jpg;a clear blue sky
233258.jpg;person with friends on the balcony
16_05_05_76.jpg;the band is playing
463904.jpg;a tree in a city
638582.jpg;the family prays during the ceremony.
73252.jpg;ship class is a - class frigate
1020724.jpg;you are never too old to set another goal or goal a dream.
759006.jpg;i'm in the game
8778.jpg;the meat is brown
O_175.jpg;actor attends the premiere during festival
737889.jpg;person, a singer, performs.
62786.jpg;tourist attraction and the statue of monarch
17_06_2030.jpg;a ticket in the hand
416901.jpg;a letter from a police officer.
546246.jpg;a man who is waiting for a person to speak
O_3763.jpg;the most popular actors of the 2000s
1846238.jpg;little girl lying on a pier
70401.jpg;baseball player celebrates with baseball player after scoring a run during the third inning of game.
16_05_15_51.jpg;the sky is cloudy
13924.jpg;actor in the kitchen of her home
736760.jpg;i like the font and the text in the middle.
O_155.jpg;attack of the sports team
17_06_12592.jpg;a brown paper bag
70648.jpg;baseball player, left, and baseball player, stand in the dugout during the second inning of a game against sports team.
1792098.jpg;a large green sign
420983.jpg;the view from the bridge.
1099286.jpg;person, a portrait of person
O_4831.jpg;a close up of an elephant's face.
575955.jpg;girl holding a bottle
842113.jpg;baseball player jumping in the air
544833.jpg;i'm not sure about this outfit but i'm not sure about the shorts.
16_05_31_110.jpg;hip hop artist performs at the concert.
67328.jpg;the new brand of food is seen in a store
92418.jpg;a pile of shoes
O_3694.jpg;basketball player and basketball player shake hands after a game.
317038.jpg;a brown building with a brown roof
71985.jpg;the man in the tub
O_333.jpg;person, who was also present at awards, was also presented with a trophy
17_06_6119.jpg;the boys are standing
660234.jpg;woman wearing orange shirt
34559.jpg;the guy in the blue shirt is my friend.
453913.jpg;film character on the stairs
O_4713.jpg;politician speaks during a campaign event.
920334.jpg;the world's biggest event of the year
655757.jpg;the lights on the roof of the police car are red, blue and green.
94391.jpg;the hand of a young woman
122346.jpg;a boy wearing a hat
114585.jpg;painting artist, children playing on the beach
126236.jpg;boy standing in front of corn
17_06_15472.jpg;the poster for the show
310296.jpg;the prime minister, who was elected as the first president, said he was not allowed to speak to the media.
50098.jpg;cartoon illustration of a cartoon character pointing at a map.
538800.jpg;person used the power to become a powerful company to produce more energy through the dollar.
63393.jpg;football player and footballer in the dressing room
966944.jpg;the view from the road.
74707.jpg;person celebrates with person after scoring a touchdown during the first half of a game.
91365.jpg;people standing on steps
O_1381.jpg;person and actor share a kiss in the mirror.
114669.jpg;the mountains are covered in snow
92821.jpg;a man laying on a bed
825646.jpg;the sign in the kitchen
O_600.jpg;politician drives a truck during a visit.
70242.jpg;the most beautiful girl in the world
544020.jpg;large screen with cartoon characters on it
93842.jpg;poster for the rock band
O_2360.jpg;a man wearing a black hoodie
2134279.jpg;the most important man in the world
63466.jpg;a man in a brown shirt
16_05_01_600.jpg;man holding a green and white shirt
116242.jpg;a dining room set with a wooden table and chairs
354008.jpg;the first screenshot of the day
O_4494.jpg;person as a soldier in uniform
7081.jpg;the crowd at the event
73944.jpg;actors attend the after party for the premiere.
17_06_501.jpg;a wall on the side of a building
460915.jpg;a woman is standing on a path
22215.jpg;basketball shooting guard is back in the day
118065.jpg;latin pop artist poses with her award at awards.
16_05_21_177.jpg;person and i at the concert
13055.jpg;the river is flowing
254097.jpg;the team takes the lead.
16_05_09_1140.jpg;a tennis court
809435.jpg;a line of people who live in the country are trying to find the most important part of the country
116742.jpg;a page from the book
O_1134.jpg;politician with a camera, and a camera.
17_06_7935.jpg;a man throwing a baseball
74827.jpg;the ocean is a beautiful sight.
117678.jpg;illustration of a map with icons
117613.jpg;autumn trees in the forest
1017940.jpg;person presenting a presentation to the students.
303099.jpg;a man wearing a hard hat
17_06_10583.jpg;dragonfly on a stick
17_06_3768.jpg;a fence behind the fence
1897389.jpg;i'm not sure what this is, but i'm not sure what the periodic table is.
737209.jpg;we are a team of people who want to be writing in our own way.
16_05_02_794.jpg;football player has been a key player for football team
660005.jpg;person with some of her friends
110927.jpg;man wearing purple shirt
17_06_11042.jpg;basketball player is the only player in history to be the most popular player in the world.
1305643.jpg;the new airport is a long - term site that will be built in the city's capital city.
1763027.jpg;person, a senior, poses for a portrait.
O_4816.jpg;letter from person to person
254520.jpg;if you want someone to sit at a desk at your desk, ask your employee.
34417.jpg;person, actor, and comedian at a game.
O_2388.jpg;politician speaks during a campaign event.
41992.jpg;person is wearing a suit
587868.jpg;person presents a cheque to person.
108822.jpg;man wearing eyeglasses
1107921.jpg;the sculpture is made of ice
93985.jpg;person and her sister, both of whom are born.
789447.jpg;dont know your children's questions, what they learn to them.
16_05_01_472.jpg;can you kick the ball?
110053.jpg;the logo is a good example of how to make a difference.
328212.jpg;a plant in the grass
O_4832.jpg;actor in jeans - leaving the gym
16_05_08_575.jpg;olympic athlete shoots against sports team during a game.
653976.jpg;a boy in a fur coat
16_05_07_62.jpg;pop artist and his band
17_06_5656.jpg;the couple share a hug in front of the car
O_1761.jpg;person, pictured above, was the first person to be evicted from her home.
113568.jpg;man with long brown hair
O_3053.jpg;politician and politician shake hands after a performance.
41977.jpg;a scene outside
O_1684.jpg;girls in bikinis on beach
O_111.jpg;man holding a little girl
O_91.jpg;basketball player drives to the basket
17_06_1762.jpg;pop artist and person perform at awards.
122075.jpg;the stage is set for the upcoming movie
430671.jpg;a picture of a bird
36313.jpg;the candy is a popular theme.
1826807.jpg;girl in a white dress
1348556.jpg;person, a woman with a hat
O_887.jpg;digital art selected for the #
250269.jpg;screen of the computer
122423.jpg;i like the fonts and fonts of this font.
916718.jpg;a girl was seen walking down the street in a protest.
17_06_3933.jpg;footballer celebrates after scoring his team's second goal during the match.
884984.jpg;a man and woman posing for a photograph
16_05_24_568.jpg;players celebrate after scoring a goal during the game against country.
122367.jpg;the key to the metal
17_06_3275.jpg;a wall on the side of a building
73926.jpg;a magazine on a beach
673538.jpg;person, who was the first person to be elected as the president, spoke at the event.
O_1578.jpg;i'm not a fan of hair but i'm not sure what it's like.
16_05_01_143.jpg;football player celebrates scoring the opening goal of the game
810527.jpg;the giant sculpture by person
93094.jpg;a man wearing a plaid shirt
114920.jpg;a snake in the wall of a house in the old city of tripoli, libya
1330223.jpg;a man carrying a box of a laptop
16_05_28_866.jpg;basketball player celebrates a win over sports team.
1114121.jpg;politician, who was the first person to be elected, was arrested by police.
46290.jpg;person in the water
65241.jpg;painting artist, the sea
821336.jpg;person, left, and person, stand on the sidelines.
1413926.jpg;person, who was the first person to walk through the crowd
116476.jpg;the pool at night is lit up with blue lights.
21398.jpg;person is a fan of the girls who love her hair
6248.jpg;a salad with a pickle
16_05_14_100.jpg;the game is colorful
17_06_2630.jpg;image of a white background with a colorful flag
775729.jpg;i can see you through the glasses.
17_06_13738.jpg;kermit the frog drinking tea - but that's none of my business
117107.jpg;politician delivers a speech during a meeting.
71826.jpg;a ship travelling on the water.
745935.jpg;the wall of the classroom
26480.jpg;this is a picture of the first person to follow.
351465.jpg;a table with a white table cloth
1896735.jpg;a black and white cat
1700095.jpg;a crowd of people holding up signs and pointing at the building.
71593.jpg;a screenshot of the day.
92321.jpg;tv writer and organization leader on the show.
549414.jpg;i'm not a fan of cartoons but i'm not sure what i'm talking about.
O_1092.jpg;woman with long black hair
501295.jpg;man holding a camera
17_06_6231.jpg;people are enjoying the outdoors
887351.jpg;a bird eating a fork
16_05_31_74.jpg;basketball shooting guard as a player.
O_23.jpg;digital art selected for the #
17_06_1385.jpg;the man in the suit
116172.jpg;the pool area at the hotel
713.jpg;baseball player, i need to be the biggest team in the world.
16_05_15_297.jpg;a black sign with orange and black letters
124191.jpg;this map shows the location of the freeway.
73563.jpg;basketball player celebrates after defeating basketball team in the championship game.
417554.jpg;the sign in the train station
71463.jpg;wallpaper with a portrait titled actor
64668.jpg;baseball player warms up before a game against sports team.
1040629.jpg;the president's office is standing in front of the building.
16_05_27_599.jpg;the girls are playing soccer
93536.jpg;a green sign on a building
523632.jpg;the poster for the national team
116241.jpg;a large area rug
67455.jpg;a recipe for dish by person
1052096.jpg;a person is riding a bike
1016444.jpg;i found this cute little toy in the bedroom of the hotel in the philippines.
17_06_3060.jpg;clouds in the sky
1135973.jpg;the rock in the sea at sunset
O_3047.jpg;person, a golden retriever, poses for a photo.
1827360.jpg;a crowd of people in a street
1813464.jpg;the earth is seen from space.
16_05_12_173.jpg;person, who is the girl with the glasses
808432.jpg;person in red and white uniform
46075.jpg;hip hop artist arrives at the premiere.
924068.jpg;a sign on a stage
110698.jpg;artist performs at a concert.
72634.jpg;two people standing on the beach
418018.jpg;a large screen on a wall
1808427.jpg;american football player and american football player on tv
606.jpg;person receives award from person.
427762.jpg;me in the mirror of the bar
27187.jpg;person, i put my heart into it and the reality of your life.
16_05_14_640.jpg;people are enjoying the outdoors
73004.jpg;soldiers on a tank
16_05_21_395.jpg;poster for the concert of the music
72389.jpg;a city in the past
O_4934.jpg;actor with her hair in a bob
123583.jpg;a wall on the side of a building
31866.jpg;the cast of tv drama
167289.jpg;a long row of flags
693731.jpg;northern lights over the glacier
1443312.jpg;vintage photograph of men on a motorcycle
304185.jpg;a beach with a few boats
66076.jpg;politician looks at her phone as she sits on the flight deck of the aircraft.
16_05_31_8.jpg;the window in the bathroom
17_06_12920.jpg;a man playing baseball
737602.jpg;poetry is the very picture of life in its own truth... but that makes a whole truth.
O_1140.jpg;the dress is white
17_06_7921.jpg;a digital compass with the word stress
552068.jpg;poster for the concert series
114751.jpg;the new face of fashion
17_06_7549.jpg;view from the top of the hill in the city of the castle
74049.jpg;man wearing a white shirt
63645.jpg;i will be back in the day.
418314.jpg;a group of men standing around a table.
638010.jpg;the game is a game of video game series
O_3958.jpg;politician has been named the most famous person in the world
O_3423.jpg;politician looks like a woman and then looks at politician
O_3558.jpg;politician, organization leader and organization leader at an event.
778361.jpg;person at the pageant
1122132.jpg;disease on the map of us
423795.jpg;politician, left, and person, meet with politician during a meeting.
16_05_09_596.jpg;how to wear a denim dress
110553.jpg;the school building was built.
659535.jpg;person, a former professional boxer, speaks during a performance.
975807.jpg;author is all smiles as she arrives at the launch of her new book.
16_05_19_727.jpg;a man in a suit
16_05_27_592.jpg;actor is the face of a man who has been named person.
750245.jpg;musical artist is a fashion model and actress.
16_05_03_1168.jpg;person gives instructions during the match.
166313.jpg;a butcher's stall in the market
363897.jpg;person at the event for person
810107.jpg;person is the new player.
17_06_6545.jpg;a blue tractor
1946002.jpg;politician delivers a speech during a meeting.
16_05_31_167.jpg;hockey player in black jersey
610146.jpg;the building is a building with a lot of windows.
231147.jpg;a wall on the side of a building
16_05_04_625.jpg;the team of the soccer team
93944.jpg;the team at the booth
1132721.jpg;the group of people posing for a photo
1908462.jpg;pop artist and rhythm and blues artist perform on stage.
17_06_10300.jpg;a black and red backpack
179497.jpg;the most interesting people in the world
71745.jpg;the building is covered in snow.
1875332.jpg;man with white hair
16_05_20_516.jpg;the t - shirt is gray
34533.jpg;painting artist, a painter who works on a painting.
O_2141.jpg;football player argues with football player after the game
O_2762.jpg;football player has been a key player for football team
506403.jpg;person and his wife pose for a photo.
16_05_29_620.jpg;poster for the show, featuring the original song.
72540.jpg;politician speaks during a campaign event.
34781.jpg;a man standing behind a podium
14874.jpg;a fan in pink for the game
1294456.jpg;a woman with pink hair
1945843.jpg;football player and football player celebrate after the final whistle
811899.jpg;a city in the spring
O_1682.jpg;woman in wheelchair
421946.jpg;woman wearing white gloves
17_06_8458.jpg;the boys in the red light district
16_05_01_289.jpg;the girl in the hat
146252.jpg;the many faces of tv character
35975.jpg;person, left, and person, both wearing hats.
O_3497.jpg;basketball shooting guard, who was the first player to score points in the game.
128712.jpg;the team walk the orange cones.
13400.jpg;map with all cities and airports.
17_06_5091.jpg;a person is playing
1131288.jpg;i have been writing this text in my first text.
809246.jpg;person is the first person to visit the school.
71107.jpg;a person is playing.
O_3966.jpg;man wearing a blue suit
O_4862.jpg;country pop artist at awards
128759.jpg;a city at night, as seen from the roof of the building.
1017918.jpg;a presentation in the office
17_06_2272.jpg;a person is standing up
12865.jpg;person speaking at the event.
776892.jpg;actor attends the premiere of the film.
735257.jpg;how to write a song about coffee
113460.jpg;a painting of a group of people
215300.jpg;a man standing in front of a screen
1078387.jpg;a wooden box
72533.jpg;the water is calm
73890.jpg;american football player celebrates after scoring a touchdown against sports team during the first half of a football game.
71848.jpg;man wearing a black hat
119519.jpg;actor - i'm a sucker for a man.
O_4486.jpg;actor speaks to the media
16_05_02_102.jpg;a grey and blue cover
63967.jpg;american football player was the best player in the world.
1315114.jpg;the sky is blue and orange
17_06_9412.jpg;digital art selected for the #
90127.jpg;person has been named the player of the year
1476273.jpg;soccer ball in the grass
74657.jpg;the paper bag has green and red letters
O_1634.jpg;person and actor on the set of tv sitcom
16_05_01_542.jpg;baseball player walks off the field before a game against sports team.
909861.jpg;man sitting on stool
O_2615.jpg;person and i share a hug with pop artist
16_05_15_2.jpg;a picture of a woman
1004021.jpg;politician speaks during a campaign event.
29296.jpg;person with his son, who is a child.
17_06_4983.jpg;a wall on the side of a building
74911.jpg;birds in a parking lot
1291819.jpg;man wearing brown jacket
673753.jpg;the sun sets over the cathedral
17_06_15372.jpg;tv series logo on yellow background
988113.jpg;a cat on a desk
37780.jpg;a group of people standing around a coin.
O_3969.jpg;video game series - - the best video game in the world
O_87.jpg;person and the girl in yellow
17_06_14267.jpg;thousands of lanterns are lit up during the lighting ceremony.
1994466.jpg;waterfall on the coast of island
64014.jpg;picture of a man
130789.jpg;geographical feature category in the desert
27398.jpg;a protest against the government
16_05_25_629.jpg;american football player, left, is sacked by american football player during the first half of a football game.
94690.jpg;actor in a black and white shirt
16_05_15_905.jpg;the net is white
656558.jpg;the columns are tall
1293934.jpg;the ballet of the year
O_2958.jpg;politician has been named the most expensive man in the world
