image_name;caption
16_05_23_942.jpg;a police officer stands guard at the entrance to the embassy.
O_4448.jpg;person - i'm not a fan of cars
16_05_22_684.jpg;person is a singer who has been nominated for award category.
16_05_02_16.jpg;a man in a suit
629358.jpg;man in gray sweater
122615.jpg;the cast of the movie
16_05_19_373.jpg;players warm up before the match.
537897.jpg;tourists on the trail to the top
15310.jpg;pizza is a popular pizza.
819411.jpg;a group of people posing for a picture
572797.jpg;actor was all smiles at the event.
1073787.jpg;the game was played by a player.
578058.jpg;the bestselling movies
172924.jpg;hand holding a piece of paper
17_06_8967.jpg;basketball shooting guard and basketball player celebrate after the game.
16_05_04_679.jpg;a group of people
O_1337.jpg;film character and person in a scene from animation film
1060397.jpg;person, left, and person perform a routine.
111166.jpg;award winner steers his car during the practice session.
17_06_2315.jpg;the poster for the film
485223.jpg;a boat on the ground
17_06_14360.jpg;image of a white background with a colorful flag
72906.jpg;the staircase inside the ship
1993030.jpg;a cart in the desert
473629.jpg;a white wall
16_05_08_340.jpg;person in a yellow jacket
16_05_18_229.jpg;basketball player looks on against basketball team during the first half of a basketball game.
656412.jpg;two women standing next to each other
16_05_29_350.jpg;football player and battle for the ball
811385.jpg;the building is white
332796.jpg;the audience at the stage
94150.jpg;actor in a pink dress
119783.jpg;a laptop on the couch
49504.jpg;a man walks past a wall with numbers and letters.
O_1432.jpg;pop artist with a little boy
65111.jpg;tourist attraction is one of the most beautiful places in the world.
71711.jpg;a person is standing up
65089.jpg;football player receives the award from cricket player.
442581.jpg;a group of people sitting in chairs
973199.jpg;young couple sitting in the theater and using tablet
988031.jpg;construction continues on the new bridge.
112875.jpg;person, a member of the audience, speaks during the event.
331285.jpg;tennis players pose for a photo.
17_06_10192.jpg;actor and person watch a game.
570654.jpg;the camera is black
120091.jpg;the back of the hair
886689.jpg;the man is wearing a green and yellow shirt
7691.jpg;i'm not sure if this is a picture of the video game.
694025.jpg;person using a gun using real - life products and then he bought them a day before he was killed today.
26493.jpg;man wearing black pants
1450627.jpg;a group of football players
1052805.jpg;man wearing blue jeans
16_05_23_515.jpg;film character and person speak during the event.
13301.jpg;the bridge is made of stone
34543.jpg;cartoon by person, the illustrator
16_05_30_726.jpg;basketball player and basketball player during game.
15439.jpg;actor poses in a blue shirt
1132698.jpg;people working in the office
17_06_2296.jpg;a green table
402186.jpg;a woman holds up a camera during a rally.
734792.jpg;in writing, play the role of a human language, it is the way you listen to the way you listen.
830057.jpg;thank you for getting a bike accident.
O_4195.jpg;classic : person was seen driving her car on the streets
64991.jpg;man wearing a blue shirt
683315.jpg;a person holding a sandwich
70757.jpg;man wearing a white shirt
21271.jpg;a man holding a baby
17_06_7424.jpg;man wearing a blue shirt
13445.jpg;the sun sets over a city
O_1941.jpg;politician speaking into a microphone
460740.jpg;the beauty of the bride
952916.jpg;the poster for the movie
16_05_16_1088.jpg;a woman with brown hair
932268.jpg;a screenshot of the map showing the location of the satellite
16_05_01_96.jpg;the back of the chair
16_05_11_264.jpg;two girls standing in a room
441548.jpg;people sitting at a table
12612.jpg;person is a professional basketball player who has been in the family for the first time.
694255.jpg;the great benefits of suffering
17_06_825.jpg;a person is standing up
1481671.jpg;person, who has won the race.
O_1859.jpg;politician was also seen at the event
O_4359.jpg;politician, the first president to be elected.
17_06_3135.jpg;woman with red hair
611656.jpg;person leads a group of musicians during a performance.
O_3025.jpg;the shoe is made from recycled plastic.
O_3912.jpg;cartoon by person on the way to the presidential election
17_06_3840.jpg;two men standing together
459221.jpg;a man wearing a green jacket
33109.jpg;a window on a vehicle.
581271.jpg;the girls in the show
371349.jpg;the story behind the smile
770560.jpg;person has signed up their daughters who will help them raise their families as they are in a group, as they are in a business
956646.jpg;person addresses the crowd at the event.
575834.jpg;the team on the summit
1310536.jpg;a poster for a business
32182.jpg;the actor with a cigarette
16_05_02_779.jpg;person is a young man
16_05_19_659.jpg;a city is a city and municipality.
234552.jpg;person, who has been spotted on a scooter, was spotted riding his scooter
16_05_19_141.jpg;a scene outside
17_06_4697.jpg;basketball player greets fans after the game.
1701666.jpg;a business that makes nothing more money, but money is money.
72925.jpg;automobile model in the desert
116341.jpg;football player holds a scarf outside stadium
O_4708.jpg;person in the closet of her apartment
695057.jpg;a gold and silver locket with a photo of the queen
74055.jpg;a group of portable toilets
1751885.jpg;the text in the middle is a red dot.
124821.jpg;a girl walks past a bus stop.
413953.jpg;scuba divers in the red sea
17_01_6148.jpg;the players are all smiles
409319.jpg;the glacier is a glacier - fed glacier that is the largest glacier in the world.
419472.jpg;person is a young man who is a young man, who is a young man.
932871.jpg;paramedics and paramedics attend to a patient after a rescue.
335247.jpg;picture is on the wall
663288.jpg;the rock is red
227313.jpg;actor, left, and actor pose with award for award category.
13693.jpg;person takes a shot with the goal
783463.jpg;a woman holds a bottle of champagne as she dances in front of a large screen.
1890794.jpg;the birthday boy by person
1794019.jpg;a red car
463995.jpg;person and actor at a private event
16_05_27_475.jpg;the football field is green and the grass is green in the background.
1077733.jpg;the dog is black
807017.jpg;person is a very popular person.
O_2951.jpg;a taxi cab driving down a busy street.
31743.jpg;this is a cartoon of a frog
756282.jpg;a poster showing the text
13405.jpg;doll with brown hair
1375990.jpg;a peacock displays its feathers.
74329.jpg;the badge is a popular design for the brand.
809137.jpg;soldiers of the army in a trench royalty - free
O_3348.jpg;person on the street with his friends
420889.jpg;a tree fell on the campus.
O_1124.jpg;pop artist goes for a walk in the dark
O_2690.jpg;the logo for the series
10876.jpg;the boy who was born in the night
13216.jpg;a tree in the water
72516.jpg;a sculpture made of metal
O_5003.jpg;a funny pic of politician on facebook
72976.jpg;menu is made of wood
879240.jpg;actor arrives at the premiere of the film.
6649.jpg;rock and roll artist in concert
17_06_9860.jpg;person plays the ball during the match.
598583.jpg;woman wearing black and white top
1123121.jpg;a man wearing a black shirt
16_05_13_615.jpg;young women with hands raised at a music festival
O_1886.jpg;woman wearing a white shirt
715454.jpg;a child riding a horse
74843.jpg;the cast of tv teen drama poses for a photo backstage during the show.
508351.jpg;the sign is lit up
1931560.jpg;this is what i want for my garden
O_2403.jpg;person posted a photo of his family's father, who was a fan of the family.
140233.jpg;man playing with dog in park
1285213.jpg;a photograph of a man holding a stick and a man holding a sword.
O_3963.jpg;hair cut in the right hand
16_05_08_1090.jpg;person with her team after the game.
O_1338.jpg;a person is playing
575598.jpg;person, a graduate, stands with his diploma during graduation ceremony.
23460.jpg;a group of men standing around a drum.
735265.jpg;a rock is a big piece of rock that is placed in the palm of a human hand.
716238.jpg;a large screen on the stage
O_2630.jpg;politician has been named the president of politician
O_1811.jpg;man wearing a black suit
73167.jpg;a crowd of people
36563.jpg;man sitting on skateboard
16_05_18_431.jpg;olympic athlete dunking a basketball
29444.jpg;a baby boy at a school
17_06_11458.jpg;a small pond in the woods
7524.jpg;american football player is the best player in the world.
71475.jpg;a man is sitting on a step stool
1995382.jpg;digital art selected for the #
16_05_04_851.jpg;a person riding a horse
O_1375.jpg;person and pop artist backstage at awards.
13434.jpg;the wallpaper with a portrait called person
16_05_30_851.jpg;a poster for a festival
830747.jpg;painting artist in the drawing room
17_06_13067.jpg;man holding a guitar
1076039.jpg;the crowd at the concert.
1412636.jpg;man wearing a red jacket
74792.jpg;a group of people paddle a boat through a pond.
778873.jpg;a group of boys play football on the beach
571410.jpg;the couch is brown
16_05_29_589.jpg;football coach acknowledges the crowd after the game.
1016119.jpg;person with a drawing of actor
16_05_23_81.jpg;a child standing in a soccer field
121913.jpg;a sign at the entrance to a store.
1687527.jpg;a footprint of a man's shoe
1873925.jpg;fans of the national soccer team
16_05_28_446.jpg;a baseball field
17_06_3542.jpg;a man in a black shirt
115326.jpg;the angel of the angel
16_05_12_660.jpg;a chain link fence
33462.jpg;i'm not a religion, but i'm so proud of a good choice.
33251.jpg;politician speaks at a podium during a speech.
454478.jpg;the bird in the bathroom
616641.jpg;a shadow on a bed
O_250.jpg;person, pictured with a black eye, was taken to hospital after he was shot by a man
71317.jpg;the sky is clear
16_05_18_128.jpg;basketball player shooting a basketball game
1086668.jpg;pop artist on the cover
16_05_13_565.jpg;the poster for the concert
702116.jpg;cartoon of a soldier with a gun
1135540.jpg;a white dog with a black nose
7446.jpg;the road is closed to traffic.
70546.jpg;the building was constructed in the late 1800s and was completed.
108966.jpg;the family of person and actor
704366.jpg;painting artist, study for a painting
74506.jpg;music video performer and neo soul artist perform at show.
984654.jpg;a man riding a bike
17_01_8855.jpg;a basketball court
17_06_3315.jpg;military commander, the first president to walk on the seafront.
456322.jpg;i'm not sure what this is, but i'm not sure what i'm talking about.
758256.jpg;the beauty of the day
O_2806.jpg;the number of people in the world has been revealed
507921.jpg;ice hockey player celebrates his goal against sports team during game.
17_06_14237.jpg;a wall on the side of a building
16_05_13_770.jpg;the logo for the festival
262027.jpg;the machine is made of metal
10790.jpg;psychedelic rock artist, psychedelic rock artist, and person.
15639.jpg;the stadium is full of people
74039.jpg;actor and pop artist arrive at the premiere of the film.
16_05_04_899.jpg;person, who was the first player to play in the team's final game, is shown in this photo.
70122.jpg;a man with short hair
63386.jpg;person was honored at the end of his tour.
16_05_16_183.jpg;a basketball player
16_05_20_1040.jpg;a wall on the side of a building
777980.jpg;person lies on the grass after being injured during the match.
1719518.jpg;woman wearing a black dress
575705.jpg;man wearing blue shirt
O_3040.jpg;the many faces of people
17_01_6531.jpg;umbrella in the rain, illustration
16_05_25_280.jpg;digital art selected for the #
886265.jpg;leather bound journal of the baseball field
17_06_7801.jpg;basketball coach reacts during the first half of a game against sports team.
10857.jpg;the wall that was left behind by the police.
471582.jpg;the new football team vs. football
1789174.jpg;actor on the cover of magazine
866289.jpg;the team with their trophies
1441282.jpg;a woman walks through the cobbled streets
686615.jpg;a sign on the wall
73655.jpg;a plane takes off from airport
25360.jpg;man wearing a blue suit
854419.jpg;person wearing a blue shirt
1468846.jpg;person and actor on the set of tv soap opera
1068402.jpg;the fire burns in the hills
74768.jpg;basketball shooting guard during a performance
16_05_30_377.jpg;lake is a lake that is surrounded by mountains.
O_4728.jpg;it is not in the stars to hold our destiny.
1764722.jpg;bottle is on the table
50167.jpg;a group of men posing for a picture
649354.jpg;a label on a jar
64050.jpg;a man holding a sign
718727.jpg;a person is holding a dog
O_1538.jpg;person in a white shirt
17_06_5397.jpg;two women sitting on a chair
427912.jpg;how to make a bag from a bag
45560.jpg;building lit up in red for the annual celebration.
233421.jpg;speculative fiction book by novelist
823028.jpg;the text of the day
1717249.jpg;the girl with the yellow eyes
1328598.jpg;the water feature is a mausoleum located.
90262.jpg;a man was greeted by a man who was waiting for his flight.
1078627.jpg;pop artist at the awards.
17_06_3665.jpg;the number is seen on a blue background.
O_1737.jpg;the app on the app
14315.jpg;the game is a bit different than the other one.
42101.jpg;the shoes that person designed for person
15991.jpg;the best dresses of the season
1092148.jpg;cat in chair
812063.jpg;green monster on the wall
994942.jpg;poster for the event held.
16_05_03_594.jpg;a line of basketballs
447186.jpg;football player and football player in the game
17_06_1801.jpg;the tv is on
O_3258.jpg;pop artist performs on stage during the first day of her show
781890.jpg;religious leader meets with religious leader during a private audience.
63211.jpg;this text is not only about the rest of our team.
1106183.jpg;pop artist and person have a meeting with you and sing to the bathroom
1994722.jpg;the lighthouse on the sea
736917.jpg;cartoon of a person with a particular expression on their face.
568036.jpg;a hand touching a cookie sheet
45438.jpg;the logo on the side of the building
16_05_06_541.jpg;the team of the week
90761.jpg;a group of kids
8700.jpg;soccer player in a green uniform kicking the ball in front of the flag
16_05_05_854.jpg;the plate is square
491226.jpg;a city is a popular tourist destination.
117297.jpg;bees around the world by person
17_06_2059.jpg;pop artist performs on the stage during the concert.
O_4441.jpg;the girls are now friends with their friends
41632.jpg;the most important players in the world
50495.jpg;a line of soldiers and their dogs
16_05_03_397.jpg;basketball player and basketball player are shown in a photo.
587018.jpg;the sign outside the entrance
67682.jpg;digital art selected for the #
17_06_5939.jpg;fans cheer on their team during a game.
13663.jpg;the first screenshot of the new campaign.
535844.jpg;a man wearing a white sweater
164486.jpg;suspension bridge from the south side
16_05_13_892.jpg;a person is standing up
17_06_15499.jpg;i'm not sure if this is a game, but i'm not sure what it is.
970880.jpg;a man in a suit
17_06_144.jpg;people are enjoying the outdoors
O_29.jpg;this is a screenshot of a video that shows a person holding a message.
328091.jpg;digital art selected for the #
17_06_3924.jpg;a scene during the day time
16_05_18_635.jpg;a man wearing a black shirt
16_05_08_439.jpg;a group of boys
673717.jpg;steering wheel is black
523281.jpg;football player is one of the most successful players in the world
73989.jpg;a car is seen during practice for event.
16_05_11_970.jpg;a man and a woman holding a basketball
34153.jpg;the man is wearing a black shirt
72035.jpg;person, a graduate, is a member of the group.
127313.jpg;the building in the background is the university of the university.
O_1976.jpg;a cd in a box
17_06_6394.jpg;the new logo for sports team
O_3819.jpg;we're all dressed up for the event!
16_05_04_126.jpg;poster for the event for the event
36015.jpg;country pop artist arrives at awards.
36756.jpg;actor, a native, poses for a portrait.
O_1082.jpg;these are the logos of the political values.
45944.jpg;a fan wears a shirt and a shirt as he watches from the stands.
783023.jpg;politician is wearing glasses
72021.jpg;a sign in the front yard of a home.
37128.jpg;i'm a girl in a bar
16_05_13_1073.jpg;video camera on a tripod
O_2854.jpg;a person is sitting down
50443.jpg;a fire burns in the streets.
1065472.jpg;person, a professional road cyclist, rides the road.
1061350.jpg;the large red circle
541745.jpg;rainbow over the plane's roof
O_467.jpg;a group of people sitting outside a hut
16_05_22_647.jpg;a baseball player wearing a red hat
149690.jpg;tower is the tallest building in the world
73415.jpg;a collection of women's dresses
O_1293.jpg;baby sitting on a bed
531729.jpg;a photograph of politician, wearing a suit and tie, taken.
8254.jpg;the hand of a woman
480359.jpg;the lake is a beautiful lake.
O_1454.jpg;a woman singing into a microphone
734832.jpg;best and worst quotes from the teacher
16_05_06_391.jpg;person and actor at the premiere
16_05_09_291.jpg;a collage of photos of a young woman wearing a pink shirt and brown pants
16_05_08_873.jpg;the team is ready for the start of the season.
93253.jpg;person, a man who has been diagnosed with disease, has been a very popular person.
127671.jpg;man holding a trophy
516394.jpg;woman wearing black shirt
16_05_09_826.jpg;the new building is designed to look like a giant sculpture.
71474.jpg;person, left, and person, both of whom are.
506639.jpg;# of the sports team skates against sports team during a game.
678754.jpg;man in red
232534.jpg;the castle is a castle located in the heart.
121899.jpg;the band on stage with person
66095.jpg;the poster for the new movie
291383.jpg;the band performing on stage
16_05_02_560.jpg;football player celebrates with soccer player after scoring his side's second goal of the game during the match.
O_4596.jpg;politician is the army of training on the net
1061504.jpg;the view from the top of the hill in the centre of the city.
646454.jpg;a conversation with people at the same time.
504988.jpg;the text is the best part of the world.
73073.jpg;a man standing on a stage
16_05_20_362.jpg;basketball player celebrates after scoring against sports team during the second half.
16_05_01_65.jpg;a plane flying over the street
114933.jpg;professional boxer in the ring
16_05_18_308.jpg;a man wearing a blue uniform
70857.jpg;ice hockey player celebrates his goal with ice hockey player during the first period of a hockey game.
120944.jpg;the most popular snacks in the world
70667.jpg;a man looks out over the skyline.
24600.jpg;team members pose for a photo.
O_2168.jpg;the crowd at the airport
1389557.jpg;the event space is a huge part of the design.
1764114.jpg;a man wearing a blue shirt
O_3762.jpg;a woman with brown hair
604890.jpg;politician, a former president, speaks during a meeting.
1286081.jpg;icon of the pope in the church of st. peter's church in st. augustine, fl..................
70885.jpg;ice hockey player in blue
O_2878.jpg;comic book character in the movie
572738.jpg;politician laughs with politician during a meeting.
32653.jpg;politician on the big screen
507852.jpg;a man in a black suit and purple tie
1403804.jpg;yellow lines on the ground
16_05_19_178.jpg;person throws a pass in the air
73635.jpg;police car lights are on
O_1583.jpg;military man in a red and white uniform
1108788.jpg;i wake up to this line of white and black ink
93325.jpg;a man holding a rope on a horse
O_3701.jpg;a group of students dressed in black robes
16_05_14_212.jpg;person is a player for the team.
O_2702.jpg;man wearing a suit
16_05_02_284.jpg;the new logo is available for purchase.
522834.jpg;the class proudly walked for the commencement ceremony.
16_05_23_589.jpg;a woman sitting in a hospital bed
16_05_11_1013.jpg;calligraphy of the year of animal
636155.jpg;a large orange fruit
16_05_01_817.jpg;a large green field
928957.jpg;fairy sitting on a dragon
16_05_02_972.jpg;the wall of the bar in the middle of the night
8831.jpg;a green couch
111458.jpg;the team bus is seen outside stadium.
73398.jpg;a file photo of a ship.
1026506.jpg;a large group of people
34919.jpg;the boat in the sky
16_05_18_666.jpg;the orchestra in red and black
118519.jpg;basketball shooting guard smiles as he is introduced before a game against sports team.
16_05_31_140.jpg;a sandy beach
907429.jpg;person in the microphone
45757.jpg;the skyline is lit up in red, white and blue.
O_3704.jpg;actor on the set of crime fiction film
73390.jpg;racecar driver and award nominee in the race
16_05_07_866.jpg;the hair is brown
94228.jpg;i'm not a fan of the music.
225346.jpg;poster of the movie that was posted on the wall
122358.jpg;a wall on the side of a building
17_06_13519.jpg;green seats in the stadium
70977.jpg;ice hockey player celebrates his goal with his teammates during a game against sports team.
506812.jpg;ice hockey player takes a shot on goal.
13563.jpg;a large crowd of people
1745869.jpg;a person is sitting down
1874256.jpg;politician and politician, left, both in their prime, are shown in a photo.
72870.jpg;american football player celebrates with teammates after scoring a touchdown during the second half of a football game against sports team
16_05_17_1078.jpg;the two men are standing in front of the fence.
O_3102.jpg;politician with a face in front of a flag
16_05_20_382.jpg;soccer player in yellow and blue uniform
O_1745.jpg;politician speaks to the media on tuesday.
830810.jpg;people take part in a protest against the government.
16_05_30_745.jpg;there is no elevator to success.
16_05_07_305.jpg;the floor is tiled
493590.jpg;person, a chef, prepares a dish.
1127187.jpg;actor in a scene from the film
474866.jpg;a black curtain
1388689.jpg;the man is wearing a black shirt
93872.jpg;poster for the concert by person
1952958.jpg;the girls were all smiles as they posed for photos
O_1343.jpg;a man holding a guitar
90045.jpg;person in action for the ball
14146.jpg;the sky is blue and white
16_05_27_502.jpg;football player in a jersey
628177.jpg;sun rays through the trees
871006.jpg;red banner on building
1081589.jpg;a little boy greets a crowd of people.
541969.jpg;person with his dog at the library.
O_4034.jpg;a newspaper
O_1277.jpg;the team in the production of play
1115220.jpg;the flag of the world
1284975.jpg;a nest of baby birds
O_2859.jpg;the app is displayed on a smartphone.
1038040.jpg;if i had a bad day, i had a bad day.
17_06_3958.jpg;logo for the musical group
36335.jpg;person sitting in a car
17_06_10489.jpg;person in a suit smiling at camera
71011.jpg;ice hockey coach in the team's practice
16_05_15_949.jpg;a scene outside
17_06_7269.jpg;the app on a tablet
116229.jpg;a chair with a pillow
O_1729.jpg;a text from the president
17_06_15370.jpg;pink and white baseball cap
16_05_30_109.jpg;the crowd at the opening ceremony.
735380.jpg;this is a picture of a cat sleeping on a couch.
727561.jpg;man wearing a brown jacket
592698.jpg;a sign for a car show
418306.jpg;fire in the background
412442.jpg;progressive metal artist perform live.
15357.jpg;person, a student, sings to a crowd.
1766622.jpg;the art of person by person
16_05_30_194.jpg;a baseball player swinging a bat
17_06_1104.jpg;the logo is a symbol of the language.
687786.jpg;i play by the love of love
17_06_3072.jpg;military man in military uniform
552611.jpg;the poster for the game
16_05_12_116.jpg;group of people posing for a picture
O_1926.jpg;the most popular actors of all time
17_06_12408.jpg;two men standing in a stadium
45806.jpg;person is a pitcher and is seen.
16_05_09_66.jpg;a woman wearing glasses
950874.jpg;person on stage during the dress rehearsal
403695.jpg;the building in the background is the building that houses the hospital.
651850.jpg;person is the best person in the world
O_1405.jpg;woman sitting on blue chair
464273.jpg;person is a model and actress, who is the model.
16_05_21_903.jpg;snow on the ground
1815128.jpg;a mountain of rock art
O_5004.jpg;a woman wearing a dress
O_955.jpg;person and her daughter, at a party.
64583.jpg;the sun sets over the mountains
1413062.jpg;the website for the website
1308055.jpg;the scene outside station where the attack took place.
178788.jpg;the scoreboard shows the court's current state of the court.
72872.jpg;american football player warms up before a game against sports team.
16_05_04_1084.jpg;person looks on during a game.
16_05_17_414.jpg;people sitting in chairs
838099.jpg;person at the press conference
34894.jpg;rhythm and blues artist poses for a portrait.
O_4676.jpg;pop artist and rhythm and blues artist
1331611.jpg;the house was damaged by a fire.
572586.jpg;the team celebrates after winning sports league championship.
117874.jpg;police detain a protester during a protest.
109607.jpg;man wearing leopard print pants
65265.jpg;the letter from the book of the former president
30836.jpg;a man fixing a car on the road
1084327.jpg;portrait of a woman
O_4660.jpg;pop artist performs at awards.
114526.jpg;a reflection of a building in the water
16_05_01_741.jpg;a baseball player throwing a ball
O_615.jpg;the first episode of tv sitcom
16_05_01_451.jpg;a wall on the side of a building
245534.jpg;a man wearing a hat
17_06_761.jpg;a painting of a man holding a sword
O_2025.jpg;black shirt with red and white print in black
17_06_12483.jpg;the choir performs during the opening ceremony.
122594.jpg;man has a beard
560439.jpg;person prepares a dish in the kitchen
133727.jpg;the tv screen in my room
67778.jpg;a portrait of person and his daughter.
123963.jpg;people walking around in front of a building
8262.jpg;the water is murky
116278.jpg;the beach in front of the hotel
16_05_11_146.jpg;person is a writer's writer, writer and writer.
737427.jpg;i'm a good day to be back.
16_05_15_1039.jpg;a logo for festival, featuring a font, a font and a line of short, orange and black lines.
16_05_27_303.jpg;person and love are a basic basic basic basic text for the love of person.
74097.jpg;woman holding signs
